pmid	doi	year	title	screening_stage	decision	primary_reason	full_text_assessed	freeze_date
37594724	10.1158/1078-0432.CCR-22-3406	2023	Anlotinib in Locally Advanced or Metastatic Radioiodine-Refractory Differentiated Thyroid Carcinoma: A Randomized, Double-Blind, Multicenter Phase II Trial.	title_abstract	exclude	no_transcriptomic_or_expression_measurement	no	2026-07-12
37886165	10.3389/fonc.2023.1139659	2023	Planned drug holidays during treatment with lenvatinib for radioiodine-refractory differentiated thyroid cancer: a retrospective study.	title_abstract	exclude	no_transcriptomic_or_expression_measurement	no	2026-07-12
36933170	10.1007/s40618-023-02059-7	2023	The role of miR-139-5p in radioiodine-resistant thyroid cancer.	title_abstract	exclude	no_eligible_human_endpoint_linked_program_or_marker	no	2026-07-12
37772080	10.3389/fendo.2023.1220617	2023	A clinically useful and biologically informative genomic classifier for papillary thyroid cancer.	title_abstract	exclude	no_eligible_human_endpoint_linked_program_or_marker	no	2026-07-12
37191938	10.1007/s12020-023-03388-6	2023	Add-on radioiodine during long-term BRAF/MEK inhibition in patients with RAI-refractory thyroid cancers: a reasonable option?	title_abstract	exclude	no_transcriptomic_or_expression_measurement	no	2026-07-12
37627224	10.3390/cancers15164196	2023	Efficacy of Empirical Radioiodine Therapy in Patients with Differentiated Thyroid Cancer and Elevated Serum Thyroglobulin without Evidence of Structural Disease: A Propensity Score Analysis.	title_abstract	exclude	no_transcriptomic_or_expression_measurement	no	2026-07-12
37664843	10.3389/fendo.2023.1158581	2023	Radioactive iodine therapy strategies for distinct types of differentiated thyroid cancer: a propensity score-matched analysis.	title_abstract	exclude	no_transcriptomic_or_expression_measurement	no	2026-07-12
37553764	10.2174/1573405620666230808161931	2023	A Case Report of Wire-localised Excision of Impalpable Recurrent Papillary Thyroid Carcinoma and Discussion of Wire-guided Excision in the Head and Neck Pathology.	title_abstract	exclude	no_eligible_human_endpoint_linked_program_or_marker	no	2026-07-12
37171634	10.1007/s00259-023-06240-1	2023	The use of single-timepoint images to link administered radioiodine activity (MBq) to a prescribed lesion radiation-absorbed dose (cGy): a regression-based prediction interval tool for the management of well-differentiated thyroid cancer patients.	title_abstract	exclude	no_eligible_human_endpoint_linked_program_or_marker	no	2026-07-12
36928602	10.1007/s12020-023-03348-0	2023	Inflammatory biomarkers predict outcomes of patients with radioactive iodine refractory thyroid cancer treated with sorafenib.	title_abstract	exclude	no_transcriptomic_or_expression_measurement	no	2026-07-12
37534207	10.3389/fendo.2023.1200932	2023	The efficacy and safety in radioactive iodine refractory thyroid cancer patients treated with sorafenib.	title_abstract	exclude	no_eligible_human_endpoint_linked_program_or_marker	no	2026-07-12
36715264	10.1210/clinem/dgad045	2023	Radioactive Iodine Therapy Decreases the Recurrence of Intermediate-Risk PTC With Low Thyroglobulin Levels.	title_abstract	exclude	no_transcriptomic_or_expression_measurement	no	2026-07-12
36905576	10.1007/s12020-023-03340-8	2023	Neutrophil-to-lymphocyte ratio as an independent factor for worse prognosis in radioiodine refractory thyroid cancer patients.	title_abstract	exclude	no_transcriptomic_or_expression_measurement	no	2026-07-12
37361050	10.7717/peerj.15592	2023	Identification of iron metabolism-related genes as prognostic indicators for papillary thyroid carcinoma: a retrospective study.	title_abstract	exclude	no_eligible_human_endpoint_linked_program_or_marker	no	2026-07-12
37373171	10.3390/ijms241210024	2023	BRAF-AXL-PD-L1 Signaling Axis as a Possible Biological Marker for RAI Treatment in the Thyroid Cancer ATA Intermediate Risk Category.	title_abstract	exclude	no_eligible_human_endpoint_linked_program_or_marker	no	2026-07-12
37317665	10.1002/ctm2.1298	2023	Integrated metabolic and genetic analysis reveals distinct features of human differentiated thyroid cancer.	title_abstract	exclude	no_eligible_human_endpoint_linked_program_or_marker	no	2026-07-12
37261582	10.1186/s13550-023-01004-2	2023	The complementary role of PSMA expression and [18F]FDG PET/CT in predicting thyroid cancer outcome: from black and white to shades of gray, in the era of precision oncology.	title_abstract	exclude	no_eligible_human_endpoint_linked_program_or_marker	no	2026-07-12
36600104	10.1007/s12020-023-03300-2	2023	Propensity score matching analysis of adjuvant external-beam radiotherapy for the treatment of papillary thyroid carcinoma with other organ invasions.	title_abstract	exclude	no_eligible_human_endpoint_linked_program_or_marker	no	2026-07-12
37146205	10.1093/bjsopen/zrad029	2023	Approach to risk stratification for papillary thyroid carcinoma based on molecular profiling: institutional analysis.	title_abstract	exclude	no_eligible_human_endpoint_linked_program_or_marker	no	2026-07-12
36960710	10.1089/thy.2023.0035	2023	A Comprehensive Study on the Diagnosis and Management of Noninvasive Follicular Thyroid Neoplasm with Papillary-Like Nuclear Features.	title_abstract	exclude	no_transcriptomic_or_expression_measurement	no	2026-07-12
36806005	10.1016/j.drup.2023.100939	2023	Radioiodine therapy in advanced differentiated thyroid cancer: Resistance and overcoming strategy.	title_abstract	exclude	no_eligible_human_endpoint_linked_program_or_marker	no	2026-07-12
36303039	10.1007/s00268-022-06813-5	2023	Thyroid Lobectomy for Low-Risk 1-4 CM Papillary Thyroid Cancer is not Associated with Increased Recurrence Rates in the Dutch Population with a Restricted Diagnostic Work-Up.	title_abstract	exclude	no_transcriptomic_or_expression_measurement	no	2026-07-12
37072862	10.1186/s13000-023-01336-6	2023	Synchronous thyroid cancer and malignant struma ovarii: concordant mutations and microRNA profile, discordant loss of heterozygosity loci.	title_abstract	exclude	no_eligible_human_endpoint_linked_program_or_marker	no	2026-07-12
36780190	10.1158/1078-0432.CCR-22-2882	2023	Genomic and Transcriptomic Characteristics of Metastatic Thyroid Cancers with Exceptional Responses to Radioactive Iodine Therapy.	title_abstract	advance_to_full_text	potentially_eligible	yes	2026-07-12
37187624	10.7759/cureus.37460	2023	Lenvatinib as a Promising Treatment Option for Unresectable Hürthle Cell Carcinoma: A Case Report.	title_abstract	exclude	no_relevant_radioiodine_construct	no	2026-07-12
36602660	10.1245/s10434-022-13020-y	2023	Five-Year Oncologic Outcome and Surgical Completeness of Transoral Robotic Thyroidectomy for Papillary Thyroid Carcinoma: Comparison with Conventional Transcervical Thyroidectomy Using Propensity Score Matching.	title_abstract	exclude	no_eligible_human_endpoint_linked_program_or_marker	no	2026-07-12
36585857	10.1089/thy.2022.0533	2023	Inhibition of ALK-Signaling Overcomes STRN-ALK-Induced Downregulation of the Sodium Iodine Symporter and Restores Radioiodine Uptake in Thyroid Cells.	title_abstract	exclude	non_human_or_preclinical_only	no	2026-07-12
36959661	10.1186/s12957-023-02886-1	2023	Single inferior parathyroid autotransplantation during total thyroidectomy with bilateral central lymph node dissection for papillary thyroid carcinoma: a retrospective cohort study.	title_abstract	exclude	no_transcriptomic_or_expression_measurement	no	2026-07-12
36945575	10.1101/2023.03.09.23287037	2023	Integrated metabolic and genetic analysis reveals distinct features of primary differentiated thyroid cancer and its metastatic potential in humans.	title_abstract	exclude	no_eligible_human_endpoint_linked_program_or_marker	no	2026-07-12
36923984	10.1055/s-0042-1759615	2023	Hurthle Cell Thyroid Carcinoma with Liver and Paraaortic Abdominal Nodal Metastasis: Progression on Sorafenib Therapy after Initial Disease Stabilization.	title_abstract	exclude	no_transcriptomic_or_expression_measurement	no	2026-07-12
36791561	10.1016/j.prp.2023.154371	2023	Significance of miRNAs on the thyroid cancer progression and resistance to treatment with special attention to the role of cross-talk between signaling pathways.	title_abstract	exclude	no_eligible_human_endpoint_linked_program_or_marker	no	2026-07-12
35918798	10.1111/cen.14804	2023	I-PET score: Combining whole body iodine and 18 F-FDG PET/CT imaging to predict progression in structurally or biochemically incomplete thyroid cancer.	title_abstract	exclude	no_transcriptomic_or_expression_measurement	no	2026-07-12
36879649	10.2147/JMDH.S403045	2023	Blood Profiles in the Prediction of Radioiodine Refractory Papillary Thyroid Cancer: A Case-Control Study.	title_abstract	exclude	no_transcriptomic_or_expression_measurement	no	2026-07-12
36672209	10.3390/cells12020274	2023	ABCA1-Mediated EMT Promotes Papillary Thyroid Cancer Malignancy through the ERK/Fra-1/ZEB1 Pathway.	title_abstract	exclude	no_eligible_human_endpoint_linked_program_or_marker	no	2026-07-12
36449303	10.1001/jamasurg.2022.5781	2023	Comparison of Lobectomy vs Total Thyroidectomy for Intermediate-Risk Papillary Thyroid Carcinoma With Lymph Node Metastasis.	title_abstract	exclude	no_transcriptomic_or_expression_measurement	no	2026-07-12
36589808	10.3389/fendo.2022.1078258	2022	The relationship of the clinicopathological characteristics and treatment results of post-Chornobyl papillary thyroid microcarcinomas with the latency period and radiation exposure.	title_abstract	exclude	no_transcriptomic_or_expression_measurement	no	2026-07-12
36707942	10.3760/cma.j.cn115330-20220511-00261	2022	[Analysis of surgical strategy for pediatric papillary thyroid carcinoma with low-intermediate risk].	title_abstract	exclude	no_transcriptomic_or_expression_measurement	no	2026-07-12
36556238	10.3390/jpm12122017	2022	Identification of Circulating Exosomal microRNAs Associated with Radioiodine Refractory in Papillary Thyroid Carcinoma.	title_abstract	advance_to_full_text	potentially_eligible	yes	2026-07-12
36523593	10.3389/fendo.2022.969914	2022	Analysis of the key ligand receptor CADM1_CADM1 in the regulation of thyroid cancer based on scRNA-seq and bulk RNA-seq data.	title_abstract	exclude	no_eligible_human_endpoint_linked_program_or_marker	no	2026-07-12
36428713	10.3390/cancers14225620	2022	Thyroid Cancer Persistence in Patients with Unreliable Thyroglobulin Measurement: Circulating microRNA as Candidate Alternative Biomarkers.	title_abstract	exclude	no_eligible_human_endpoint_linked_program_or_marker	no	2026-07-12
36303869	10.3389/fendo.2022.968215	2022	The relationship between thyroid disorders and vitamin A.: A narrative minireview.	title_abstract	exclude	non_human_or_preclinical_only	no	2026-07-12
36195340	10.1503/cjs.009121	2022	Relation between surgical oncologic quality indicators for papillary thyroid cancer.	title_abstract	exclude	no_transcriptomic_or_expression_measurement	no	2026-07-12
36068937	10.1097/MED.0000000000000740	2022	Advanced imaging and theranostics in thyroid cancer.	title_abstract	exclude	no_eligible_human_endpoint_linked_program_or_marker	no	2026-07-12
35983596	10.1089/thy.2022.0234	2022	Propensity Score Matched Outcome Analysis of Lobar Ablation Versus Completion Thyroidectomy in Low-Risk Differentiated Thyroid Cancer Patients: Median Follow-Up of 11 Years.	title_abstract	exclude	no_eligible_human_endpoint_linked_program_or_marker	no	2026-07-12
35836040	10.1007/s40618-022-01852-0	2022	Retraction Note to: Inhibition of microRNA‑875‑5p promotes radioiodine uptake in poorly differentiated thyroid carcinoma cells by upregulating sodium-iodide symporter.	title_abstract	exclude	no_eligible_human_endpoint_linked_program_or_marker	no	2026-07-12
36230610	10.3390/cancers14194687	2022	BRAFV600E Expression in Thyrocytes Causes Recruitment of Immunosuppressive STABILIN-1 Macrophages.	title_abstract	exclude	non_human_or_preclinical_only	no	2026-07-12
36147070	10.1016/j.amsu.2022.104538	2022	Management of lymph nodes in medullary thyroid carcinoma: A review.	title_abstract	exclude	review_or_secondary_source	no	2026-07-12
35833358	10.1080/14737140.2022.2102000	2022	Efficacy and safety of multi-kinase inhibitors in patients with radioiodine-refractory differentiated thyroid cancer: a systematic review and meta-analysis of clinical trials.	title_abstract	exclude	review_or_secondary_source	no	2026-07-12
35799079	10.1007/s12020-022-03115-7	2022	Non-invasive follicular neoplasm with papillary-like nuclear features: a challenging and infrequent entity in Argentina.	title_abstract	exclude	no_transcriptomic_or_expression_measurement	no	2026-07-12
36193505	10.1155/2022/8735551	2022	A Potential Four-Gene Signature and Nomogram for Predicting the Overall Survival of Papillary Thyroid Cancer.	title_abstract	exclude	no_eligible_human_endpoint_linked_program_or_marker	no	2026-07-12
35748791	10.1177/1098612X221104743	2022	Radioiodine treatment of hyperthyroidism in cats: results of 165 cats treated by an individualised dosing algorithm in Spain.	title_abstract	exclude	no_transcriptomic_or_expression_measurement	no	2026-07-12
35501518	10.1007/s00259-022-05820-x	2022	The genetic duet of BRAF V600E and TERT promoter mutations predicts the poor curative effect of radioiodine therapy in papillary thyroid cancer.	title_abstract	exclude	no_eligible_human_endpoint_linked_program_or_marker	no	2026-07-12
35904608	10.1186/s13550-022-00917-8	2022	Scoring system and a simple nomogram for predicting radioiodine refractory differentiated thyroid cancer: a retrospective study.	title_abstract	exclude	no_transcriptomic_or_expression_measurement	no	2026-07-12
35867385	10.2196/35565	2022	Salivary Dysfunctions and Consequences After Radioiodine Treatment for Thyroid Cancer: Protocol for a Self-Controlled Study (START Study).	title_abstract	exclude	no_eligible_human_endpoint_linked_program_or_marker	no	2026-07-12
35924153	10.3389/fonc.2022.871792	2022	Indoleamine 2,3-Dioxygenase Immune Status as a Potential Biomarker of Radioiodine Efficacy for Advanced Distant Metastatic Differentiated Thyroid Cancer.	title_abstract	exclude	no_transcriptomic_or_expression_measurement	no	2026-07-12
35556126	10.1210/clinem/dgac305	2022	Non-Iodine-Avid Disease Is Highly Prevalent in Distant Metastatic Differentiated Thyroid Cancer With Papillary Histology.	title_abstract	exclude	no_transcriptomic_or_expression_measurement	no	2026-07-12
35482606	10.1093/oncolo/oyac065	2022	Lenvatinib for the Treatment of Radioiodine-Refractory Differentiated Thyroid Cancer: Treatment Optimization for Maximum Clinical Benefit.	title_abstract	exclude	no_transcriptomic_or_expression_measurement	no	2026-07-12
35738604	10.21873/invivo.12866	2022	Circulating microRNAs and Clinicopathological Findings of Papillary Thyroid Cancer: A Systematic Review.	title_abstract	exclude	review_or_secondary_source	no	2026-07-12
35439719	10.1016/j.clinimag.2022.04.003	2022	Low correlation between serum thyroglobulin and 131I radioiodine whole body scintigraphy: implication for postoperative disease surveillance in differentiated thyroid cancer.	title_abstract	exclude	no_transcriptomic_or_expression_measurement	no	2026-07-12
35318124	10.1016/j.jvir.2022.03.016	2022	Safety and Efficacy of Percutaneous Cryoablation of Extraspinal Thyroid Cancer Bone Metastases with Curative Intent: Single-Center Experience with a Median Follow-up of More than 5 Years.	title_abstract	exclude	no_transcriptomic_or_expression_measurement	no	2026-07-12
35693983	10.1155/2022/3676886	2022	Effectiveness and Safety of Levothyroxine Tablets Combined with Iodine-131 in the Treatment of Thyroid Cancer.	title_abstract	exclude	no_transcriptomic_or_expression_measurement	no	2026-07-12
35475024	10.1210/jendso/bvac048	2022	Lenvatinib Therapy for Advanced Thyroid Cancer: Real-Life Data on Safety, Efficacy, and Some Rare Side Effects.	title_abstract	exclude	no_transcriptomic_or_expression_measurement	no	2026-07-12
35634509	10.3389/fendo.2022.865909	2022	Construction of a Signature Model to Predict the Radioactive Iodine Response of Papillary Thyroid Cancer.	title_abstract	advance_to_full_text	potentially_eligible	yes	2026-07-12
35602883	10.1016/j.aace.2022.01.002	2022	Incidental Solitary Adrenal Metastasis as the Initial Manifestation of a Solid Variant of Papillary Thyroid Carcinoma, With Emphasis on Pathologic Diagnosis and Clinical Management.	title_abstract	exclude	no_eligible_human_endpoint_linked_program_or_marker	no	2026-07-12
35266878	10.1530/ERC-22-0006	2022	Advanced RAI-refractory thyroid cancer: an update on treatment perspectives.	title_abstract	exclude	no_eligible_human_endpoint_linked_program_or_marker	no	2026-07-12
35450096	10.1177/20420188221090005	2022	Is eNAMPT/visfatin a potential serum marker of papillary thyroid cancer?	title_abstract	exclude	no_transcriptomic_or_expression_measurement	no	2026-07-12
35260027	10.1080/14737140.2022.2039123	2022	Lenvatinib dose, efficacy, and safety in the treatment of multiple malignancies.	title_abstract	exclude	no_transcriptomic_or_expression_measurement	no	2026-07-12
34999951	10.1007/s00520-022-06799-9	2022	Factors affecting the health-promoting behavior of thyroid cancer survivors: comparison by stage of cancer survivorship.	title_abstract	exclude	no_transcriptomic_or_expression_measurement	no	2026-07-12
34855206	10.1111/eci.13721	2022	Markedly elevated serum preoperative thyroglobulin predicts radioiodine-refractory thyroid cancer.	title_abstract	exclude	no_transcriptomic_or_expression_measurement	no	2026-07-12
34583388	10.1055/a-1580-7327	2022	[Treatment strategy by radioiodine refractory differentiated thyroid cancer].	title_abstract	exclude	no_transcriptomic_or_expression_measurement	no	2026-07-12
35723359	10.3390/cimb44040101	2022	Propensity Score-Matched Analysis to Identify Pathways Associated with Loss of Sodium Iodide Symporter in Papillary Thyroid Cancer.	title_abstract	advance_to_full_text	potentially_eligible	yes	2026-07-12
35326735	10.3390/cancers14061584	2022	APOBEC SBS13 Mutational Signature-A Novel Predictor of Radioactive Iodine Refractory Papillary Thyroid Carcinoma.	title_abstract	exclude	no_transcriptomic_or_expression_measurement	no	2026-07-12
34520744	10.1016/j.chembiol.2021.07.016	2022	Targeting non-canonical pathways as a strategy to modulate the sodium iodide symporter.	title_abstract	exclude	no_relevant_radioiodine_construct	no	2026-07-12
35267662	10.3390/cancers14051353	2022	Comprehensive Analysis of the Prognosis and Drug Sensitivity of Differentiation-Related lncRNAs in Papillary Thyroid Cancer.	title_abstract	exclude	no_eligible_human_endpoint_linked_program_or_marker	no	2026-07-12
35311230	10.3389/fendo.2022.842424	2022	Clinical-Pathological Features and Treatment Outcome of Patients With Hobnail Variant Papillary Thyroid Carcinoma.	title_abstract	exclude	no_transcriptomic_or_expression_measurement	no	2026-07-12
35462674	10.1007/s13193-021-01445-y	2022	Audit of Demographics, Treatment Patterns and Outcomes of Differentiated Thyroid Cancers Treated with Tyrosine Kinase Inhibitors.	title_abstract	exclude	no_transcriptomic_or_expression_measurement	no	2026-07-12
35282451	10.3389/fendo.2022.768028	2022	Feasibility of Apatinib in Radioiodine-Refractory Differentiated Thyroid Carcinoma.	title_abstract	exclude	no_transcriptomic_or_expression_measurement	no	2026-07-12
35205190	10.3390/biology11020324	2022	Identification of DPP4/CTNNB1/MET as a Theranostic Signature of Thyroid Cancer and Evaluation of the Therapeutic Potential of Sitagliptin.	title_abstract	exclude	non_human_or_preclinical_only	no	2026-07-12
34664662	10.1210/clinem/dgab731	2022	A Randomized Study of Lenvatinib 18 mg vs 24 mg in Patients With Radioiodine-Refractory Differentiated Thyroid Cancer.	title_abstract	exclude	no_transcriptomic_or_expression_measurement	no	2026-07-12
35136135	10.1038/s41598-022-06071-4	2022	Age-related long-term response in rat thyroid tissue and plasma after internal low dose exposure to 131I.	title_abstract	exclude	no_eligible_human_endpoint_linked_program_or_marker	no	2026-07-12
35063220	10.1016/j.clnesp.2021.11.026	2022	Low iodine diet advice and differentiated thyroid cancer treatment: A historic exploration in three UK centres.	title_abstract	exclude	no_transcriptomic_or_expression_measurement	no	2026-07-12
34913959	10.1001/jamaoncol.2021.6268	2022	Apatinib vs Placebo in Patients With Locally Advanced or Metastatic, Radioactive Iodine-Refractory Differentiated Thyroid Cancer: The REALITY Randomized Clinical Trial.	title_abstract	exclude	no_transcriptomic_or_expression_measurement	no	2026-07-12
35116229	10.5306/wjco.v13.i1.9	2022	New approaches for patients with advanced radioiodine-refractory thyroid cancer.	title_abstract	exclude	no_transcriptomic_or_expression_measurement	no	2026-07-12
34751390	10.1093/jmcb/mjab072	2022	Capsaicin restores sodium iodine symporter-mediated radioiodine uptake through bypassing canonical TSH‒TSHR pathway in anaplastic thyroid carcinoma cells.	title_abstract	exclude	non_human_or_preclinical_only	no	2026-07-12
35059180	10.1155/2022/9944083	2022	Clinicopathological Profile of Thyroid Carcinoma in Young Patients: An Indonesian Single-Center Study.	title_abstract	exclude	no_transcriptomic_or_expression_measurement	no	2026-07-12
34861772	10.1089/thy.2021.0356	2022	Surgical Management of Low-/Intermediate-Risk Node Negative Thyroid Cancer: A Single-Institution Study Using Propensity Matching Analysis to Compare Thyroid Lobectomy and Total Thyroidectomy.	title_abstract	exclude	no_transcriptomic_or_expression_measurement	no	2026-07-12
34641705	10.1089/thy.2021.0412	2022	Novel Fibroblast Activation Protein Inhibitor-Based Targeted Theranostics for Radioiodine-Refractory Differentiated Thyroid Cancer Patients: A Pilot Study.	title_abstract	exclude	no_transcriptomic_or_expression_measurement	no	2026-07-12
34580845	10.5146/tjpath.2021.01558	2022	PD-L1 Expression in Medullary Thyroid Carcinoma and Its Association with Clinicopathological Findings.	title_abstract	exclude	no_eligible_human_endpoint_linked_program_or_marker	no	2026-07-12
35002727	10.3389/fphar.2021.795386	2021	AhR Antagonist Promotes Differentiation of Papillary Thyroid Cancer via Regulating circSH2B3/miR-4640-5P/IGF2BP2 Axis.	title_abstract	exclude	no_eligible_human_endpoint_linked_program_or_marker	no	2026-07-12
34993154	10.3389/fonc.2021.813802	2021	Mutation of Hashimoto's Thyroiditis and Papillary Thyroid Carcinoma Related Genes and the Screening of Candidate Genes.	title_abstract	exclude	no_eligible_human_endpoint_linked_program_or_marker	no	2026-07-12
34975751	10.3389/fendo.2021.774275	2021	Antithyroglobulin Antibody Variation During Follow-Up Has a Good Prognostic Value for Preoperative Antithyroglobulin Antibody-Positive Differentiated Thyroid Cancer Patients: A Retrospective Study in Southwest China.	title_abstract	exclude	no_transcriptomic_or_expression_measurement	no	2026-07-12
34944814	10.3390/cancers13246194	2021	Advances in Biomarker-Driven Targeted Therapies in Thyroid Cancer.	title_abstract	exclude	no_transcriptomic_or_expression_measurement	no	2026-07-12
34610756	10.1089/thy.2021.0307	2021	The Efficacy and Safety of Anlotinib in Neoadjuvant Treatment of Locally Advanced Thyroid Cancer: A Single-Arm Phase II Clinical Trial.	title_abstract	exclude	no_transcriptomic_or_expression_measurement	no	2026-07-12
34541894	10.1089/thy.2021.0248	2021	Minimal Extrathyroidal Extension in Predicting 1-Year Outcomes: A Longitudinal Multicenter Study of Low-to-Intermediate-Risk Papillary Thyroid Carcinoma (ITCO#4).	title_abstract	exclude	no_transcriptomic_or_expression_measurement	no	2026-07-12
34325091	10.1016/j.bioelechem.2021.107888	2021	Highly sensitive electrochemical immunosensor using a protein-polyvinylidene fluoride nanocomposite for human thyroglobulin.	title_abstract	exclude	no_transcriptomic_or_expression_measurement	no	2026-07-12
34331544	10.1210/clinem/dgab563	2021	PSMA Expression in Differentiated Thyroid Cancer: Association With Radioiodine, 18FDG Uptake, and Patient Outcome.	title_abstract	exclude	no_eligible_human_endpoint_linked_program_or_marker	no	2026-07-12
34771624	10.3390/cancers13215460	2021	Analysis of NIS Plasma Membrane Interactors Discloses Key Regulation by a SRC/RAC1/PAK1/PIP5K/EZRIN Pathway with Potential Implications for Radioiodine Re-Sensitization Therapy in Thyroid Cancer.	title_abstract	exclude	no_eligible_human_endpoint_linked_program_or_marker	no	2026-07-12
34663816	10.1038/s41467-021-26343-3	2021	Single-cell transcriptomic analysis of the tumor ecosystems underlying initiation and progression of papillary thyroid carcinoma.	title_abstract	exclude	no_eligible_human_endpoint_linked_program_or_marker	no	2026-07-12
34620852	10.1038/s41467-021-26081-6	2021	High-resolution positron emission microscopy of patient-derived tumor organoids.	title_abstract	exclude	no_transcriptomic_or_expression_measurement	no	2026-07-12
34562750	10.1016/j.esmoop.2021.100250	2021	Phase I/II study of single-agent lenvatinib in children and adolescents with refractory or relapsed solid malignancies and young adults with osteosarcoma (ITCC-050)☆.	title_abstract	exclude	no_transcriptomic_or_expression_measurement	no	2026-07-12
34155923	10.1089/thy.2021.0013	2021	Outcomes of Thyrotropin Alfa Versus Levothyroxine Withdrawal-Aided Radioiodine Therapy for Distant Metastasis of Papillary Thyroid Cancer.	title_abstract	exclude	no_transcriptomic_or_expression_measurement	no	2026-07-12
34143519	10.1002/jcb.30016	2021	Cytokines: Application in recurrence appraisal for differentiated thyroid carcinoma and their relation with radioiodine ablation.	title_abstract	exclude	no_eligible_human_endpoint_linked_program_or_marker	no	2026-07-12
