pmid	doi	year	title	screening_stage	decision	primary_reason	full_text_assessed	freeze_date
34323243	10.1039/d1fo01073e	2021	Curcumin enhances the membrane trafficking of the sodium iodide symporter and augments radioiodine uptake in dedifferentiated thyroid cancer cells via suppression of the PI3K-AKT signaling pathway.	title_abstract	exclude	no_eligible_human_endpoint_linked_program_or_marker	no	2026-07-12
34572876	10.3390/cancers13184649	2021	MicroRNA-Based Risk Score for Predicting Tumor Progression Following Radioactive Iodine Ablation in Well-Differentiated Thyroid Cancer Patients: A Propensity-Score Matched Analysis.	title_abstract	advance_to_full_text	potentially_eligible	yes	2026-07-12
34523607	10.1172/JCI152696	2021	Oncogene-specific inhibition in the treatment of advanced pediatric thyroid cancer.	title_abstract	exclude	no_eligible_human_endpoint_linked_program_or_marker	no	2026-07-12
34237031	10.1172/JCI144847	2021	NTRK and RET fusion-directed therapy in pediatric thyroid cancer yields a tumor response and radioiodine uptake.	title_abstract	exclude	no_eligible_human_endpoint_linked_program_or_marker	no	2026-07-12
34061291	10.1007/s12149-021-01635-2	2021	Usefulness of albumin-globulin ratio as a clinical prognostic factor in patients with thyroid cancer treated with radioiodine.	title_abstract	exclude	no_transcriptomic_or_expression_measurement	no	2026-07-12
34595070	10.7759/cureus.17488	2021	Redifferentiation of BRAF V600E-Mutated Radioiodine Refractory Metastatic Papillary Thyroid Cancer After Treatment With Dabrafenib and Trametinib.	title_abstract	exclude	no_transcriptomic_or_expression_measurement	no	2026-07-12
34503146	10.3390/cancers13174335	2021	A Three-Domain Scoring System to Customize the Risk of Relapse of Differentiated Thyroid Carcinoma.	title_abstract	exclude	no_transcriptomic_or_expression_measurement	no	2026-07-12
34512731	10.3389/fgene.2021.721832	2021	A Multiplex Thyroid-Specific Assay for Quantification of Circulating Thyroid Cell-Free RNA in Plasma of Thyroid Cancer Patients.	title_abstract	exclude	no_eligible_human_endpoint_linked_program_or_marker	no	2026-07-12
34475850	10.3389/fendo.2021.712107	2021	FGF-Receptors and PD-L1 in Anaplastic and Poorly Differentiated Thyroid Cancer: Evaluation of the Preclinical Rationale.	title_abstract	exclude	no_eligible_human_endpoint_linked_program_or_marker	no	2026-07-12
34149901	10.3892/ol.2021.12851	2021	IGF2 is a potential factor in RAI-refractory differentiated thyroid cancer.	title_abstract	advance_to_full_text	potentially_eligible	yes	2026-07-12
33749950	10.1002/gcc.22949	2021	Histology-based molecular profiling improves mutation detection for advanced thyroid cancer.	title_abstract	exclude	no_eligible_human_endpoint_linked_program_or_marker	no	2026-07-12
33648765	10.1016/j.surg.2021.01.022	2021	Association between quality of life and patient-reported complications from surgery and radioiodine in early-stage thyroid cancer survivors: A matched-pair analysis.	title_abstract	exclude	no_transcriptomic_or_expression_measurement	no	2026-07-12
33277400	10.2967/jnumed.120.255679	2021	Phase I Trial of 131I-GMIB-Anti-HER2-VHH1, a New Promising Candidate for HER2-Targeted Radionuclide Therapy in Breast Cancer Patients.	title_abstract	exclude	no_transcriptomic_or_expression_measurement	no	2026-07-12
34223823	10.1530/EC-21-0215	2021	Risk stratification in differentiated thyroid cancer with RAI-avid lung metastases.	title_abstract	exclude	no_transcriptomic_or_expression_measurement	no	2026-07-12
33961488	10.1200/JCO.20.03093	2021	Open-Label, Single-Arm, Multicenter, Phase II Trial of Lenvatinib for the Treatment of Patients With Anaplastic Thyroid Cancer.	title_abstract	exclude	no_transcriptomic_or_expression_measurement	no	2026-07-12
34298820	10.3390/cancers13143609	2021	TNF-α May Exert Different Antitumor Effects in Response to Radioactive Iodine Therapy in Papillary Thyroid Cancer with/without Autoimmune Thyroiditis.	title_abstract	exclude	no_transcriptomic_or_expression_measurement	no	2026-07-12
34357141	10.3390/jpm11070674	2021	Predictors of Response and Survival to Multikinase Inhibitors in Radioiodine Resistant Differentiated Thyroid Cancer.	title_abstract	exclude	no_transcriptomic_or_expression_measurement	no	2026-07-12
34266418	10.1186/s12935-021-02066-9	2021	Identification and validation of an immune-related prognostic signature and key gene in papillary thyroid carcinoma.	title_abstract	exclude	no_eligible_human_endpoint_linked_program_or_marker	no	2026-07-12
34000025	10.1210/clinem/dgab343	2021	G Protein-coupled Receptors in Radioiodine-refractory Thyroid Cancer in the Era of Precision Medicine.	title_abstract	exclude	no_eligible_human_endpoint_linked_program_or_marker	no	2026-07-12
33769497	10.1210/clinem/dgab196	2021	Long-Term Results of a Phase II Trial of Apatinib for Progressive Radioiodine Refractory Differentiated Thyroid Cancer.	title_abstract	exclude	no_transcriptomic_or_expression_measurement	no	2026-07-12
39421700	10.20945/2359-3997000000373	2021	Safety and efficacy of sorafenib in patients with advanced thyroid carcinoma: a phase II study (NCT02084732).	title_abstract	exclude	no_transcriptomic_or_expression_measurement	no	2026-07-12
34285957	10.14338/IJPT-D-20-00053	2021	Initial Experience with Proton Beam Therapy for Differentiated Thyroid Cancer.	title_abstract	exclude	no_transcriptomic_or_expression_measurement	no	2026-07-12
33660317	10.1111/cen.14455	2021	Bilateral multifocality, a marker for aggressive disease, is not an independent prognostic factor for papillary thyroid microcarcinoma: A propensity score matching analysis.	title_abstract	exclude	no_transcriptomic_or_expression_measurement	no	2026-07-12
34221969	10.3389/fonc.2021.649323	2021	The ETS Inhibitor YK-4-279 Suppresses Thyroid Cancer Progression Independent of TERT Promoter Mutations.	title_abstract	exclude	non_human_or_preclinical_only	no	2026-07-12
33968182	10.3892/etm.2021.10084	2021	miR-221-3p and miR-222-3p regulate the SOCS3/STAT3 signaling pathway to downregulate the expression of NIS and reduce radiosensitivity in thyroid cancer.	title_abstract	exclude	non_human_or_preclinical_only	no	2026-07-12
33559196	10.1002/hed.26637	2021	Radioactive iodine therapy may not improve disease-specific survival in follicular variant papillary thyroid cancer without distant metastasis: A propensity score-matched analysis.	title_abstract	exclude	no_transcriptomic_or_expression_measurement	no	2026-07-12
33534128	10.1007/s13402-021-00588-y	2021	Digoxin treatment reactivates in vivo radioactive iodide uptake and correlates with favorable clinical outcome in non-medullary thyroid cancer.	title_abstract	advance_to_full_text	potentially_eligible	yes	2026-07-12
33176626	10.1089/thy.2020.0297	2021	A Positive Feedback Loop Between DICER1 and Differentiation Transcription Factors Is Important for Thyroid Tumorigenesis.	title_abstract	exclude	non_human_or_preclinical_only	no	2026-07-12
33890869	10.1530/ERC-21-0017	2021	Co-inhibition of SMAD and MAPK signaling enhances 124I uptake in BRAF-mutant thyroid cancers.	title_abstract	exclude	no_relevant_radioiodine_construct	no	2026-07-12
34095490	10.1016/j.aace.2021.01.005	2021	Well-Differentiated Thyroid Cancer Invading the Trachea in a Pediatric Patient.	title_abstract	exclude	no_eligible_human_endpoint_linked_program_or_marker	no	2026-07-12
33318036	10.1158/2159-8290.CD-20-0735	2021	SWI/SNF Complex Mutations Promote Thyroid Tumor Progression and Insensitivity to Redifferentiation Therapies.	title_abstract	exclude	non_human_or_preclinical_only	no	2026-07-12
33649840	10.3892/or.2021.7954	2021	Roles of the SNHG7/microRNA‑9‑5p/DPP4 ceRNA network in the growth and 131I resistance of thyroid carcinoma cells through PI3K/Akt activation.	title_abstract	exclude	non_human_or_preclinical_only	no	2026-07-12
33306632	10.1097/MNM.0000000000001340	2021	Clinical association of CXCR4 in primary tumor of papillary thyroid cancer and response to iodine-131 treatment.	title_abstract	exclude	no_eligible_human_endpoint_linked_program_or_marker	no	2026-07-12
33377969	10.1210/clinem/dgaa973	2021	Selective Use of Radioactive Iodine Therapy for Papillary Thyroid Cancers With Low or Lower-Intermediate Recurrence Risk.	title_abstract	exclude	no_transcriptomic_or_expression_measurement	no	2026-07-12
33842329	10.3389/fonc.2021.626076	2021	Case Report: Anlotinib Therapy in a Patient With Recurrent and Metastatic RAIR-DTC Harboring Coexistent TERT Promoter and BRAFV600E Mutations.	title_abstract	exclude	no_transcriptomic_or_expression_measurement	no	2026-07-12
33748479	10.1016/j.heliyon.2021.e06408	2021	DNA repair pathway activation features in follicular and papillary thyroid tumors, interrogated using 95 experimental RNA sequencing profiles.	title_abstract	advance_to_full_text	potentially_eligible	yes	2026-07-12
33716974	10.3389/fendo.2021.623182	2021	Do Molecular Profiles of Primary Versus Metastatic Radioiodine Refractory Differentiated Thyroid Cancer Differ?	title_abstract	exclude	no_eligible_human_endpoint_linked_program_or_marker	no	2026-07-12
33708253	10.1155/2021/6642971	2021	Long-Term Oncological Outcome Comparison between Intermediate- and High-Dose Radioactive Iodine Ablation in Patients with Differentiated Thyroid Carcinoma: A Propensity Score Matching Study.	title_abstract	exclude	no_transcriptomic_or_expression_measurement	no	2026-07-12
33671989	10.3390/cancers13040811	2021	Serum CYFRA 21.1 Level Predicts Disease Course in Thyroid Cancer with Distant Metastasis.	title_abstract	exclude	no_transcriptomic_or_expression_measurement	no	2026-07-12
33628533	10.1155/2021/8837399	2021	Aggressive Differentiated Thyroid Cancer due to EML4e13-ALKe20 Fusion: A Case Presentation and Review of the Literature.	title_abstract	exclude	review_or_secondary_source	no	2026-07-12
32907501	10.1089/thy.2020.0276	2021	Safety and Quality-of-Life Data from an Italian Expanded Access Program of Lenvatinib for Treatment of Thyroid Cancer.	title_abstract	exclude	no_eligible_human_endpoint_linked_program_or_marker	no	2026-07-12
33553403	10.12998/wjcc.v9.i3.644	2021	Treatment of cervical spine metastasis with minimally invasive cervical spondylectomy: A case report and literature review.	title_abstract	exclude	review_or_secondary_source	no	2026-07-12
33499100	10.3390/ijms22031077	2021	Tunicamycin as a Novel Redifferentiation Agent in Radioiodine Therapy for Anaplastic Thyroid Cancer.	title_abstract	exclude	non_human_or_preclinical_only	no	2026-07-12
33489878	10.3389/fonc.2020.566365	2020	Downregulation of miR-146b-3p Inhibits Proliferation and Migration and Modulates the Expression and Location of Sodium/Iodide Symporter in Dedifferentiated Thyroid Cancer by Potentially Targeting MUC20.	title_abstract	exclude	no_eligible_human_endpoint_linked_program_or_marker	no	2026-07-12
33419403	10.1186/s12885-020-07735-y	2021	Thyroid cancer overdiagnosis and overtreatment: a cross- sectional study at a thyroid cancer referral center in Ecuador.	title_abstract	exclude	no_transcriptomic_or_expression_measurement	no	2026-07-12
34888848	10.1007/978-3-030-83282-7_7	2021	Noncoding RNAs in Papillary Thyroid Cancer: Interaction with Cancer-Associated Fibroblasts (CAFs) in the Tumor Microenvironment (TME) and Regulators of Differentiation and Lymph Node Metastasis.	title_abstract	exclude	no_eligible_human_endpoint_linked_program_or_marker	no	2026-07-12
33759638	10.1177/15330338211004950	2021	Knockdown of circ_NEK6 Decreased 131I Resistance of Differentiated Thyroid Carcinoma via Regulating miR-370-3p/MYH9 Axis.	title_abstract	exclude	no_eligible_human_endpoint_linked_program_or_marker	no	2026-07-12
32977343	10.1210/clinem/dgaa687	2021	New Horizons: Emerging Therapies and Targets in Thyroid Cancer.	title_abstract	exclude	no_transcriptomic_or_expression_measurement	no	2026-07-12
32310011	10.1080/09553002.2020.1748739	2021	Utility of gene expression studies in relation to radiation exposure and clinical outcomes: thyroid cancer in the Ukrainian-American cohort and late health effects in a MAYAK worker cohort.	title_abstract	exclude	no_relevant_radioiodine_construct	no	2026-07-12
33102692	10.1016/j.omto.2020.08.015	2020	FOXA1 Regulation Turns Benzamide HDACi Treatment Effect-Specific in BC, Promoting NIS Gene-Mediated Targeted Radioiodine Therapy.	title_abstract	exclude	no_eligible_human_endpoint_linked_program_or_marker	no	2026-07-12
33202517	10.3803/EnM.2020.747	2020	Clinical Outcomes after Early and Delayed Radioiodine Remnant Ablation in Patients with Low-Risk Papillary Thyroid Carcinoma: Propensity Score Matching Analysis.	title_abstract	exclude	no_transcriptomic_or_expression_measurement	no	2026-07-12
33198784	10.1186/s13046-020-01757-x	2020	The molecular and gene/miRNA expression profiles of radioiodine resistant papillary thyroid cancer.	title_abstract	advance_to_full_text	potentially_eligible	yes	2026-07-12
33158279	10.3390/cancers12113264	2020	Non-Coding RNAs: Uncharted Mediators of Thyroid Cancer Pathogenesis.	title_abstract	exclude	no_relevant_radioiodine_construct	no	2026-07-12
32372305	10.1007/s12020-020-02328-y	2020	Lymphocyte-to-monocyte ratio prior to radioiodine ablation in low- and intermediate-risk, papillary thyroid cancer.	title_abstract	exclude	no_transcriptomic_or_expression_measurement	no	2026-07-12
33142750	10.3390/cancers12113212	2020	Patient-Derived Papillary Thyroid Cancer Organoids for Radioactive Iodine Refractory Screening.	title_abstract	exclude	no_eligible_human_endpoint_linked_program_or_marker	no	2026-07-12
32688334	10.1530/EJE-20-0088	2020	No difference in the outcome of metastatic thyroid cancer patients when using recombinant or endogenous TSH.	title_abstract	exclude	no_transcriptomic_or_expression_measurement	no	2026-07-12
33117686	10.3389/fonc.2020.549882	2020	Clinical, Pathological, and Molecular Characteristics Correlating to the Occurrence of Radioiodine Refractory Differentiated Thyroid Carcinoma: A Systematic Review and Meta-Analysis.	title_abstract	exclude	review_or_secondary_source	no	2026-07-12
33471692	10.4158/EP-2020-0053	2020	Immunoglobulin Preparations Can Mislead Clinical Decision-Making in Follow-Up of Differentiated Thyroid Cancer.	title_abstract	exclude	no_transcriptomic_or_expression_measurement	no	2026-07-12
32646613	10.1053/j.semdp.2020.06.001	2020	Noninvasive follicular thyroid neoplasm with papillary-like nuclear features (NIFTP): Diagnostic updates and molecular advances.	title_abstract	exclude	no_relevant_radioiodine_construct	no	2026-07-12
32538690	10.1089/thy.2019.0269	2020	An International Phase 2 Study of Pazopanib in Progressive and Metastatic Thyroglobulin Antibody Negative Radioactive Iodine Refractory Differentiated Thyroid Cancer.	title_abstract	exclude	no_transcriptomic_or_expression_measurement	no	2026-07-12
32075524	10.1089/thy.2019.0453	2020	Surufatinib in Chinese Patients with Locally Advanced or Metastatic Differentiated Thyroid Cancer and Medullary Thyroid Cancer: A Multicenter, Open-Label, Phase II Trial.	title_abstract	exclude	no_eligible_human_endpoint_linked_program_or_marker	no	2026-07-12
31765488	10.1002/lary.28342	2020	Does Salivary Function Decrease in Proportion to Radioiodine Dose?	title_abstract	exclude	non_human_or_preclinical_only	no	2026-07-12
32825789	10.3390/jcm9092708	2020	Dynamic Risk Stratification for Predicting Treatment Response in Differentiated Thyroid Cancer.	title_abstract	exclude	no_transcriptomic_or_expression_measurement	no	2026-07-12
32612576	10.3389/fendo.2020.00382	2020	Urinary Exosomal Thyroglobulin in Thyroid Cancer Patients With Post-ablative Therapy: A New Biomarker in Thyroid Cancer.	title_abstract	exclude	no_transcriptomic_or_expression_measurement	no	2026-07-12
32278511	10.1016/j.taap.2020.114999	2020	Phenylephrine alleviates 131I damage in submandibular gland through promoting endogenous stem cell regeneration via lissencephaly-1 upregulation.	title_abstract	exclude	no_eligible_human_endpoint_linked_program_or_marker	no	2026-07-12
32486143	10.3390/cancers12061413	2020	Prognostic Implications of CD10 and CD15 Expression in Papillary Thyroid Carcinoma.	title_abstract	exclude	no_eligible_human_endpoint_linked_program_or_marker	no	2026-07-12
32528402	10.3389/fendo.2020.00082	2020	New Therapies for Advanced Thyroid Cancer.	title_abstract	exclude	no_relevant_radioiodine_construct	no	2026-07-12
32509153	10.1155/2020/7453406	2020	Elucidation of the Molecular Mechanisms Underlying Sorafenib-Induced Hepatotoxicity.	title_abstract	exclude	no_eligible_human_endpoint_linked_program_or_marker	no	2026-07-12
32385375	10.1038/s41598-020-64455-w	2020	Deep learning enables automated localization of the metastatic lymph node for thyroid cancer on 131I post-ablation whole-body planar scans.	title_abstract	exclude	no_eligible_human_endpoint_linked_program_or_marker	no	2026-07-12
31910091	10.1089/thy.2019.0476	2020	Lenvatinib for Radioactive Iodine-Refractory Differentiated Thyroid Carcinoma and Candidate Biomarkers Associated with Survival: A Multicenter Study in Korea.	title_abstract	exclude	no_transcriptomic_or_expression_measurement	no	2026-07-12
32425887	10.3389/fendo.2020.00269	2020	GADD45B Transcript Is a Prognostic Marker in Papillary Thyroid Carcinoma Patients Treated With Total Thyroidectomy and Radioiodine Therapy.	title_abstract	exclude	no_eligible_human_endpoint_linked_program_or_marker	no	2026-07-12
32157920	10.1080/17434440.2020.1741348	2020	Theranostic approaches in nuclear medicine: current status and future prospects.	title_abstract	exclude	no_transcriptomic_or_expression_measurement	no	2026-07-12
31784881	10.1007/s12020-019-02148-9	2020	Efficacy of low radioiodine activity versus intermediate-high activity in the ablation of low-risk differentiated thyroid cancer.	title_abstract	exclude	no_transcriptomic_or_expression_measurement	no	2026-07-12
31612419	10.1007/s40618-019-01125-3	2020	Inhibition of microRNA-875-5p promotes radioiodine uptake in poorly differentiated thyroid carcinoma cells by upregulating sodium-iodide symporter.	title_abstract	exclude	non_human_or_preclinical_only	no	2026-07-12
32198408	10.1038/s41598-020-61985-1	2020	Enhanced expression of Cyclin D1 and C-myc, a prognostic factor and possible mechanism for recurrence of papillary thyroid carcinoma.	title_abstract	exclude	no_eligible_human_endpoint_linked_program_or_marker	no	2026-07-12
32207271	10.3803/EnM.2020.35.1.115	2020	Quality of Life in Patients with Papillary Thyroid Microcarcinoma According to Treatment: Total Thyroidectomy with or without Radioactive Iodine Ablation.	title_abstract	exclude	no_eligible_human_endpoint_linked_program_or_marker	no	2026-07-12
31970877	10.1111/jcmm.15007	2020	Combined tazemetostat and MAPKi enhances differentiation of papillary thyroid cancer cells harbouring BRAFV600E by synergistically decreasing global trimethylation of H3K27.	title_abstract	exclude	no_eligible_human_endpoint_linked_program_or_marker	no	2026-07-12
31922240	10.3892/ijo.2020.4957	2020	Iodine‑131 metabolic radiotherapy leads to cell death and genomic alterations through NIS overexpression on cholangiocarcinoma.	title_abstract	exclude	non_human_or_preclinical_only	no	2026-07-12
31978980	10.3390/cancers12020262	2020	Optimization of Predictive Performance for the Therapeutic Response Using Iodine Scan-Corrected Serum Thyroglobulin in Patients with Differentiated Thyroid Carcinoma.	title_abstract	exclude	no_transcriptomic_or_expression_measurement	no	2026-07-12
32361719	10.1967/s002449912018	2020	Associating radioiodine therapy in hyperthyroidism with cancer mortality: robust or random results of a statistical analysis?	title_abstract	exclude	no_transcriptomic_or_expression_measurement	no	2026-07-12
32056515	10.2174/1568009619666191016145602	2020	Uptake of [¹⁸F]tetrafluoroborate in MCF-7 Breast Cancer Cells is Induced after Stimulation of the Sodium Iodide Symporter.	title_abstract	exclude	no_eligible_human_endpoint_linked_program_or_marker	no	2026-07-12
31672844	10.1158/0008-5472.CAN-19-1957	2020	Targeting Novel Sodium Iodide Symporter Interactors ADP-Ribosylation Factor 4 and Valosin-Containing Protein Enhances Radioiodine Uptake.	title_abstract	exclude	no_eligible_human_endpoint_linked_program_or_marker	no	2026-07-12
31665790	10.1055/a-1023-4214	2020	Anti-Tumor Activity and Safety of Multikinase Inhibitors in Advanced and/or Metastatic Thyroid Cancer: A Systematic Review and Network Meta-Analysis of Randomized Controlled Trials.	title_abstract	exclude	review_or_secondary_source	no	2026-07-12
31663136	10.1111/cen.14120	2020	Prognostic role of the lymphocyte-to-monocyte ratio for clinical outcomes of patients with progressive radioiodine-refractory differentiated thyroid carcinoma treated by sorafenib.	title_abstract	exclude	no_transcriptomic_or_expression_measurement	no	2026-07-12
31578932	10.1089/thy.2018.0601	2020	Thyroid Follicular Cell Loss of Differentiation Induced by MicroRNA miR-17-92 Cluster Is Attenuated by CRISPR/Cas9n Gene Silencing in Anaplastic Thyroid Cancer.	title_abstract	exclude	non_human_or_preclinical_only	no	2026-07-12
31540966	10.1158/1535-7163.MCT-19-0211	2020	Identification of Expression Profiles Defining Distinct Prognostic Subsets of Radioactive-Iodine Refractory Differentiated Thyroid Cancer from the DECISION Trial.	title_abstract	advance_to_full_text	potentially_eligible	yes	2026-07-12
31888560	10.1186/s12885-019-6482-7	2019	Comprehensive gene expression analysis for exploring the association between glucose metabolism and differentiation of thyroid cancer.	title_abstract	advance_to_full_text	potentially_eligible	yes	2026-07-12
31861373	10.3390/ijms21010010	2019	Multikinase Inhibitor Treatment in Thyroid Cancer.	title_abstract	exclude	no_transcriptomic_or_expression_measurement	no	2026-07-12
31444962	10.1515/cclm-2019-0654	2019	Unstimulated high-sensitive thyroglobulin is a powerful prognostic predictor in patients with thyroid cancer.	title_abstract	exclude	no_transcriptomic_or_expression_measurement	no	2026-07-12
31558473	10.1158/1078-0432.CCR-18-3439	2019	Analysis of Biomarkers and Association With Clinical Outcomes in Patients With Differentiated Thyroid Cancer: Subanalysis of the Sorafenib Phase III DECISION Trial.	title_abstract	exclude	no_transcriptomic_or_expression_measurement	no	2026-07-12
31868336	10.32471/exp-oncology.2312-8852.vol-41-no-4.13705	2019	Immunocytochemical characteristics of thyrocytes in radioiodine refractory metastases of papillary thyroid cancer.	title_abstract	exclude	no_eligible_human_endpoint_linked_program_or_marker	no	2026-07-12
31798211	10.1055/s-0039-1696651	2019	Ethanol Ablation of Neck Metastases from Differentiated Thyroid Carcinoma.	title_abstract	exclude	no_transcriptomic_or_expression_measurement	no	2026-07-12
31412230	10.4158/EP-2019-0265	2019	MOLECULAR PROFILE AND CLINICAL OUTCOMES IN DIFFERENTIATED THYROID CANCER PATIENTS PRESENTING WITH BONE METASTASIS.	title_abstract	exclude	no_eligible_human_endpoint_linked_program_or_marker	no	2026-07-12
31412228	10.4158/EP-2019-0155	2019	UNFAVORABLE RESPONSES TO RADIOIODINE THERAPY IN N1B PAPILLARY THYROID CANCER: A PROPENSITY SCORE MATCHING STUDY.	title_abstract	exclude	no_eligible_human_endpoint_linked_program_or_marker	no	2026-07-12
31617002	10.1186/s13550-019-0559-9	2019	PSMA expression level predicts differentiated thyroid cancer aggressiveness and patient outcome.	title_abstract	exclude	no_eligible_human_endpoint_linked_program_or_marker	no	2026-07-12
31768337	10.1159/000501680	2019	Sorafenib and Sunitinib for the Treatment of Metastatic Thyroid Cancer of Follicular Origin: A 7-Year Single-Centre Experience.	title_abstract	exclude	no_eligible_human_endpoint_linked_program_or_marker	no	2026-07-12
31516569	10.3892/ol.2019.10721	2019	Sulfasalazine suppresses thyroid cancer cell proliferation and metastasis through T-cell originated protein kinase.	title_abstract	exclude	no_eligible_human_endpoint_linked_program_or_marker	no	2026-07-12
31298630	10.1089/thy.2019.0284	2019	Mouse Model of Thyroid Cancer Progression and Dedifferentiation Driven by STRN-ALK Expression and Loss of p53: Evidence for the Existence of Two Types of Poorly Differentiated Carcinoma.	title_abstract	exclude	non_human_or_preclinical_only	no	2026-07-12
31611847	10.3389/fendo.2019.00671	2019	Re-treatment With Adjuvant Radioactive Iodine Does Not Improve Recurrence-Free Survival of Patients With Differentiated Thyroid Cancer.	title_abstract	exclude	no_transcriptomic_or_expression_measurement	no	2026-07-12
31102417	10.1111/cen.14039	2019	Impact of delayed radioiodine therapy in intermediate-/high-risk papillary thyroid carcinoma.	title_abstract	exclude	no_transcriptomic_or_expression_measurement	no	2026-07-12
31283406	10.1200/JCO.18.02228	2019	Patient-Perceived Lack of Choice in Receipt of Radioactive Iodine for Treatment of Differentiated Thyroid Cancer.	title_abstract	exclude	no_transcriptomic_or_expression_measurement	no	2026-07-12
31010838	10.1158/1078-0432.CCR-18-3007	2019	A Novel Orally Active Inverse Agonist of Estrogen-related Receptor Gamma (ERRγ), DN200434, A Booster of NIS in Anaplastic Thyroid Cancer.	title_abstract	exclude	no_eligible_human_endpoint_linked_program_or_marker	no	2026-07-12
31418590	10.2217/fon-2019-0096	2019	Evaluation of the QTc interval during lenvatinib treatment in radioiodine-refractory differentiated thyroid cancer: reports from the real-life clinical practice.	title_abstract	exclude	no_transcriptomic_or_expression_measurement	no	2026-07-12
29557257	10.1177/0962280218764006	2019	Regression models with asymmetric data for estimating thyroglobulin levels one year after the ablation of thyroid cancer.	title_abstract	exclude	no_eligible_human_endpoint_linked_program_or_marker	no	2026-07-12
