pmid	doi	year	title	screening_stage	decision	primary_reason	full_text_assessed	freeze_date
31026111	10.1002/iub.2056	2019	TERT promoter mutation in primary papillary thyroid carcinoma lesions predicts absent or lower 131 i uptake in metastases.	title_abstract	exclude	no_eligible_human_endpoint_linked_program_or_marker	no	2026-07-12
30256977	10.1210/jc.2018-01478	2019	Vemurafenib Redifferentiation of BRAF Mutant, RAI-Refractory Thyroid Cancers.	title_abstract	advance_to_full_text	potentially_eligible	yes	2026-07-12
29462007	10.1097/SLA.0000000000002710	2019	Risk Factors for Recurrence After Treatment of N1b Papillary Thyroid Carcinoma.	title_abstract	exclude	no_transcriptomic_or_expression_measurement	no	2026-07-12
30799769	10.1089/thy.2018.0547	2019	Multifocality Is not an Independent Prognostic Factor in Papillary Thyroid Cancer: A Propensity Score-Matching Analysis.	title_abstract	exclude	no_transcriptomic_or_expression_measurement	no	2026-07-12
30689169	10.1007/s12020-019-01848-6	2019	Outcome and molecular characteristics of non-invasive encapsulated follicular variant of papillary thyroid carcinoma with oncocytic features.	title_abstract	exclude	no_relevant_radioiodine_construct	no	2026-07-12
30847387	10.1016/j.omto.2019.01.007	2019	MAPK Inhibitors Enhance HDAC Inhibitor-Induced Redifferentiation in Papillary Thyroid Cancer Cells Harboring BRAF V600E: An In Vitro Study.	title_abstract	exclude	non_human_or_preclinical_only	no	2026-07-12
30972024	10.3389/fendo.2019.00172	2019	Efficacy of Central Neck Dissection for Clinically Node-Negative Papillary Thyroid Carcinoma: Propensity Scoring Matching.	title_abstract	exclude	no_eligible_human_endpoint_linked_program_or_marker	no	2026-07-12
30913016	10.4158/EP-2018-0342	2019	PROGRAMMED CELL DEATH-LIGAND 1 OVEREXPRESSION IN THYROID CANCER.	title_abstract	exclude	no_eligible_human_endpoint_linked_program_or_marker	no	2026-07-12
30638399	10.2217/fon-2018-0557	2019	A Phase II study of the safety and efficacy of lenvatinib in patients with advanced thyroid cancer.	title_abstract	exclude	no_transcriptomic_or_expression_measurement	no	2026-07-12
30219245	10.1016/j.surg.2018.07.038	2019	Comparison of short-term oncologic outcome of robotic thyroid surgery using dynamic risk stratification: A propensity score-matched comparison study.	title_abstract	exclude	no_transcriptomic_or_expression_measurement	no	2026-07-12
30707227	10.1001/jamanetworkopen.2018.7754	2019	Association of Thyrotropin Suppression With Survival Outcomes in Patients With Intermediate- and High-Risk Differentiated Thyroid Cancer.	title_abstract	exclude	no_transcriptomic_or_expression_measurement	no	2026-07-12
30685073	10.1053/j.seminoncol.2018.11.004	2019	Managing the adverse events associated with lenvatinib therapy in radioiodine-refractory differentiated thyroid cancer.	title_abstract	exclude	no_transcriptomic_or_expression_measurement	no	2026-07-12
30596336	10.1080/15384101.2018.1560203	2019	Downregulation of NEAT1 reverses the radioactive iodine resistance of papillary thyroid carcinoma cell via miR-101-3p/FN1/PI3K-AKT signaling pathway.	title_abstract	exclude	non_human_or_preclinical_only	no	2026-07-12
30274732	10.1016/j.surg.2018.04.059	2019	High-dose radioactive iodine therapy is associated with decreased risk of recurrence in high-risk papillary thyroid cancer.	title_abstract	exclude	no_transcriptomic_or_expression_measurement	no	2026-07-12
30504373	10.21873/anticanres.13032	2018	Effect of Combined Epigenetic Treatments and Ectopic NIS Expression on Undifferentiated Thyroid Cancer Cells.	title_abstract	exclude	no_eligible_human_endpoint_linked_program_or_marker	no	2026-07-12
30272320	10.3892/or.2018.6739	2018	MicroRNA‑mRNA integrated analysis based on a case of well‑differentiated thyroid cancer with both metastasis and metastatic recurrence.	title_abstract	exclude	no_relevant_radioiodine_construct	no	2026-07-12
30244318	10.1007/s00280-018-3687-4	2018	Exposure-response analysis and simulation of lenvatinib safety and efficacy in patients with radioiodine-refractory differentiated thyroid cancer.	title_abstract	exclude	no_transcriptomic_or_expression_measurement	no	2026-07-12
30145748	10.1007/s12020-018-1724-z	2018	30mCi radioactive iodine achieving comparative excellent response in intermediate/high-risk nonmetastatic papillary thyroid cancer: a propensity score matching study.	title_abstract	exclude	no_transcriptomic_or_expression_measurement	no	2026-07-12
30430914	10.2217/pgs-2018-0070	2018	Genetic polymorphism contributes to 131I radiotherapy-induced toxicities in patients with differentiated thyroid cancer.	title_abstract	exclude	no_eligible_human_endpoint_linked_program_or_marker	no	2026-07-12
30264548	10.1002/cam4.1794	2018	Radioiodine refractoriness score: A multivariable prediction model for postoperative radioiodine-refractory differentiated thyroid carcinomas.	title_abstract	exclude	no_transcriptomic_or_expression_measurement	no	2026-07-12
29937466	10.1507/endocrj.EJ18-0074	2018	Enduring remission of active and sight-threatening Graves' orbitopathy with rituximab: report of two cases.	title_abstract	exclude	no_transcriptomic_or_expression_measurement	no	2026-07-12
30005868	10.1016/j.ymthe.2018.06.015	2018	MicroRNA-125b Interacts with Foxp3 to Induce Autophagy in Thyroid Cancer.	title_abstract	exclude	non_human_or_preclinical_only	no	2026-07-12
31168186	10.20471/acc.2018.57.03.16	2018	THYROGLOBULIN AS A TUMOR MARKER IN DIFFERENTIATED THYROID CANCER - CLINICAL CONSIDERATIONS.	title_abstract	exclude	no_transcriptomic_or_expression_measurement	no	2026-07-12
30032061	10.1016/j.ctrv.2018.06.019	2018	Optimisation of treatment with lenvatinib in radioactive iodine-refractory differentiated thyroid cancer.	title_abstract	exclude	no_transcriptomic_or_expression_measurement	no	2026-07-12
30021359	10.1016/j.biopha.2018.06.087	2018	LncRNA MEG3 enhances 131I sensitivity in thyroid carcinoma via sponging miR-182.	title_abstract	exclude	no_eligible_human_endpoint_linked_program_or_marker	no	2026-07-12
30186966	10.1002/lio2.171	2018	Staged Thyroidectomy: A Single Institution Perspective.	title_abstract	exclude	no_transcriptomic_or_expression_measurement	no	2026-07-12
30038597	10.3389/fendo.2018.00360	2018	Long Non-coding Antisense RNA TNRC6C-AS1 Is Activated in Papillary Thyroid Cancer and Promotes Cancer Progression by Suppressing TNRC6C Expression.	title_abstract	exclude	non_human_or_preclinical_only	no	2026-07-12
29498921	10.4158/EP171983.OR	2018	ENHANCED BETA-CATENIN EXPRESSION IS ASSOCIATED WITH RECURRENCE OF PAPILLARY THYROID CARCINOMA.	title_abstract	exclude	no_eligible_human_endpoint_linked_program_or_marker	no	2026-07-12
29242405	10.2967/jnumed.117.200675	2018	Digitalislike Compounds Restore hNIS Expression and Iodide Uptake Capacity in Anaplastic Thyroid Cancer.	title_abstract	exclude	no_eligible_human_endpoint_linked_program_or_marker	no	2026-07-12
29610391	10.1101/mcs.a002568	2018	Application of genomics to identify therapeutic targets in recurrent pediatric papillary thyroid carcinoma.	title_abstract	exclude	no_eligible_human_endpoint_linked_program_or_marker	no	2026-07-12
29165687	10.1093/jnci/djx209	2018	Investigation of the Relationship Between Radiation Dose and Gene Mutations and Fusions in Post-Chernobyl Thyroid Cancer.	title_abstract	exclude	no_relevant_radioiodine_construct	no	2026-07-12
29095527	10.1111/cen.13508	2018	Clinical guidance for radioiodine refractory differentiated thyroid cancer.	title_abstract	exclude	no_eligible_human_endpoint_linked_program_or_marker	no	2026-07-12
29491097	10.21873/anticanres.12396	2018	Lenvatinib in Advanced Radioiodine-refractory Thyroid Cancer: A Snapshot of Real-life Clinical Practice.	title_abstract	exclude	no_transcriptomic_or_expression_measurement	no	2026-07-12
29413458	10.1016/j.nucmedbio.2017.12.002	2018	Long-term biodistribution study of HPMA-ran-LMA copolymers in vivo by means of 131I-labeling.	title_abstract	exclude	no_eligible_human_endpoint_linked_program_or_marker	no	2026-07-12
29581772	10.7150/jca.23042	2018	CXCR4/CXCR7/CXCL12-Axis in Follicular Thyroid Carcinoma.	title_abstract	exclude	no_eligible_human_endpoint_linked_program_or_marker	no	2026-07-12
29495389	10.3390/ijms19030655	2018	The rs2910164 Genetic Variant of miR-146a-3p Is Associated with Increased Overall Mortality in Patients with Follicular Variant Papillary Thyroid Carcinoma.	title_abstract	exclude	no_eligible_human_endpoint_linked_program_or_marker	no	2026-07-12
30025398	10.1159/000491898	2018	Circulating Tumor Cells Correlate with Clinicopathological Features and Outcomes in Differentiated Thyroid Cancer.	title_abstract	exclude	no_transcriptomic_or_expression_measurement	no	2026-07-12
29856242	10.1177/2058738418772652	2018	LncRNA BISPR promotes the progression of thyroid papillary carcinoma by regulating miR-21-5p.	title_abstract	exclude	non_human_or_preclinical_only	no	2026-07-12
29344270	10.7150/jca.22318	2018	Lenvatinib in Advanced Radioiodine-Refractory Thyroid Cancer - A Retrospective Analysis of the Swiss Lenvatinib Named Patient Program.	title_abstract	exclude	no_eligible_human_endpoint_linked_program_or_marker	no	2026-07-12
28954584	10.1089/thy.2017.0283	2018	Lessons from Fukushima: Latest Findings of Thyroid Cancer After the Fukushima Nuclear Power Plant Accident.	title_abstract	exclude	no_eligible_human_endpoint_linked_program_or_marker	no	2026-07-12
29132262	10.1089/thy.2017.0383	2017	Diastolic Dysfunction is Common in Survivors of Pediatric Differentiated Thyroid Carcinoma.	title_abstract	exclude	no_transcriptomic_or_expression_measurement	no	2026-07-12
28236116	10.1007/s13318-017-0403-4	2017	Clinical Pharmacokinetic and Pharmacodynamic Profile of Lenvatinib, an Orally Active, Small-Molecule, Multitargeted Tyrosine Kinase Inhibitor.	title_abstract	exclude	no_eligible_human_endpoint_linked_program_or_marker	no	2026-07-12
28128522	10.1111/coa.12835	2017	Clinicopathological relevance of antithyroglobulin antibodies in low-risk papillary thyroid cancer.	title_abstract	exclude	no_eligible_human_endpoint_linked_program_or_marker	no	2026-07-12
28011236	10.1016/j.mce.2016.12.017	2017	MicroRNAs in thyroid development, function and tumorigenesis.	title_abstract	exclude	no_eligible_human_endpoint_linked_program_or_marker	no	2026-07-12
28931558	10.1530/JME-17-0134	2017	Pathological processes and therapeutic advances in radioiodide refractory thyroid cancer.	title_abstract	exclude	no_eligible_human_endpoint_linked_program_or_marker	no	2026-07-12
28124274	10.1245/s10434-017-5780-z	2017	Upregulation of the ESR1 Gene and ESR Ratio (ESR1/ESR2) is Associated with a Worse Prognosis in Papillary Thyroid Carcinoma: The Impact of the Estrogen Receptor α/β Expression on Clinical Outcomes in Papillary Thyroid Carcinoma Patients.	title_abstract	exclude	no_eligible_human_endpoint_linked_program_or_marker	no	2026-07-12
28004221	10.1007/s10238-016-0445-y	2017	Overexpression of teneurin transmembrane protein 1 is a potential marker of disease progression in papillary thyroid carcinoma.	title_abstract	exclude	no_eligible_human_endpoint_linked_program_or_marker	no	2026-07-12
28467308	10.1515/cclm-2017-0033	2017	Thyroglobulin autoantibodies before radioiodine ablation predict differentiated thyroid cancer outcome.	title_abstract	exclude	no_transcriptomic_or_expression_measurement	no	2026-07-12
29156680	10.18632/oncotarget.21262	2017	Vemurafenib-resistance via de novo RBM genes mutations and chromosome 5 aberrations is overcome by combined therapy with palbociclib in thyroid carcinoma with BRAFV600E.	title_abstract	exclude	no_eligible_human_endpoint_linked_program_or_marker	no	2026-07-12
28816536	10.4158/EP171822.OR	2017	OPTIMIZING LENVATINIB THERAPY IN PATIENTS WITH METASTATIC RADIOACTIVE IODINE-RESISTANT DIFFERENTIATED THYROID CANCERS.	title_abstract	exclude	no_transcriptomic_or_expression_measurement	no	2026-07-12
28687563	10.1530/EJE-17-0243	2017	Axitinib treatment in advanced RAI-resistant differentiated thyroid cancer (DTC) and refractory medullary thyroid cancer (MTC).	title_abstract	exclude	no_transcriptomic_or_expression_measurement	no	2026-07-12
28337546	10.1007/s00464-017-5433-0	2017	Robotic thyroidectomy versus conventional open thyroidectomy for thyroid cancer: a systematic review and meta-analysis.	title_abstract	exclude	review_or_secondary_source	no	2026-07-12
29324929		2017	Our solution for fusion of simultaneusly acquired whole body scintigrams and optical images, as usesful tool in clinical practice in patients with differentiated thyroid carcinomas after radioiodine therapy. A useful tool in clinical practice.	title_abstract	exclude	no_transcriptomic_or_expression_measurement	no	2026-07-12
28881369	10.1055/s-0043-109180	2017	[Molecular Pathogenesis of Thyroid Nodules: Relevance for Clinical Care].	title_abstract	exclude	no_eligible_human_endpoint_linked_program_or_marker	no	2026-07-12
28635560	10.1089/thy.2016.0621	2017	Sorafenib in Japanese Patients with Locally Advanced or Metastatic Medullary Thyroid Carcinoma and Anaplastic Thyroid Carcinoma.	title_abstract	exclude	no_transcriptomic_or_expression_measurement	no	2026-07-12
28969240	10.7860/JCDR/2017/27340.10431	2017	A Functional Scoring System Based on Salivary Gland Scintigraphy for Evaluating Salivary Gland Dysfunction Secondary to 131I therapy in Patients with Differentiated Thyroid Carcinoma.	title_abstract	exclude	no_transcriptomic_or_expression_measurement	no	2026-07-12
28704384	10.1371/journal.pone.0179664	2017	Quantitative thyroglobulin response to radioactive iodine treatment in predicting radioactive iodine-refractory thyroid cancer with pulmonary metastasis.	title_abstract	exclude	no_transcriptomic_or_expression_measurement	no	2026-07-12
28265769	10.1007/s00432-017-2380-z	2017	Curcumin induces G2/M arrest, apoptosis, NF-κB inhibition, and expression of differentiation genes in thyroid carcinoma cells.	title_abstract	exclude	non_human_or_preclinical_only	no	2026-07-12
28237867	10.1016/j.ejca.2017.01.013	2017	Exploratory analysis of biomarkers associated with clinical outcomes from the study of lenvatinib in differentiated cancer of the thyroid.	title_abstract	exclude	no_transcriptomic_or_expression_measurement	no	2026-07-12
28423638	10.18632/oncotarget.15773	2017	HER inhibitor promotes BRAF/MEK inhibitor-induced redifferentiation in papillary thyroid cancer harboring BRAFV600E.	title_abstract	exclude	no_eligible_human_endpoint_linked_program_or_marker	no	2026-07-12
28294980	10.3390/ijms18030636	2017	MicroRNA-146b: A Novel Biomarker and Therapeutic Target for Human Papillary Thyroid Cancer.	title_abstract	exclude	no_eligible_human_endpoint_linked_program_or_marker	no	2026-07-12
28055301	10.1080/15548627.2016.1271512	2017	Autophagy orchestrates adaptive responses to targeted therapy in endometrial cancer.	title_abstract	exclude	no_eligible_human_endpoint_linked_program_or_marker	no	2026-07-12
30063430	10.1080/17446651.2017.1300526	2017	Managing tyrosine kinase inhibitors side effects in thyroid cancer.	title_abstract	exclude	no_transcriptomic_or_expression_measurement	no	2026-07-12
27774578	10.1007/s00423-016-1528-7	2017	Propensity score-matched analysis of robotic versus endoscopic bilateral axillo-breast approach (BABA) thyroidectomy in papillary thyroid carcinoma.	title_abstract	exclude	no_transcriptomic_or_expression_measurement	no	2026-07-12
27688081	10.1007/s12022-016-9454-3	2017	TERT Promoter Mutation in an Aggressive Cribriform Morular Variant of Papillary Thyroid Carcinoma.	title_abstract	exclude	no_eligible_human_endpoint_linked_program_or_marker	no	2026-07-12
28030816	10.18632/oncotarget.14162	2017	Down-regulation of 14q32-encoded miRNAs and tumor suppressor role for miR-654-3p in papillary thyroid cancer.	title_abstract	exclude	non_human_or_preclinical_only	no	2026-07-12
27824301	10.1089/thy.2016.0260	2017	Measurement and Variation in Estimation of Quality of Life Effects of Patients Undergoing Treatment for Papillary Thyroid Carcinoma.	title_abstract	exclude	no_eligible_human_endpoint_linked_program_or_marker	no	2026-07-12
27677707	10.1016/j.ijsu.2016.09.083	2017	Total thyroidectomy versus thyroid lobectomy for papillary thyroid cancer: Comparative analysis after propensity score matching: A multicenter study.	title_abstract	exclude	no_transcriptomic_or_expression_measurement	no	2026-07-12
27624581	10.1245/s10434-016-5552-1	2017	Computed Tomography-Detected Central Lymph Node Metastasis in Ultrasonography Node-Negative Papillary Thyroid Carcinoma: Is It Really Significant?	title_abstract	exclude	no_transcriptomic_or_expression_measurement	no	2026-07-12
28099584	10.1590/1414-431X20165933	2017	Iodine-131 treatment of thyroid cancer cells leads to suppression of cell proliferation followed by induction of cell apoptosis and cell cycle arrest by regulation of B-cell translocation gene 2-mediated JNK/NF-κB pathways.	title_abstract	exclude	non_human_or_preclinical_only	no	2026-07-12
27440272	10.1158/1078-0432.CCR-16-0914	2017	Bromodomain and Extraterminal Protein Inhibitor JQ1 Suppresses Thyroid Tumor Growth in a Mouse Model.	title_abstract	exclude	no_eligible_human_endpoint_linked_program_or_marker	no	2026-07-12
28572820	10.1155/2017/7053959	2017	TSH Variability of Patients Affected by Differentiated Thyroid Cancer Treated with Levothyroxine Liquid Solution or Tablet Form.	title_abstract	exclude	no_transcriptomic_or_expression_measurement	no	2026-07-12
27734713	10.1080/14737140.2016.1247697	2016	Lenvatinib for the treatment of radioiodine-refractory differentiated thyroid carcinoma: a systematic review and indirect comparison with sorafenib.	title_abstract	exclude	review_or_secondary_source	no	2026-07-12
27339871	10.2967/jnumed.115.169888	2016	Effects of Radioiodine Treatment on Salivary Gland Function in Patients with Differentiated Thyroid Carcinoma: A Prospective Study.	title_abstract	exclude	no_transcriptomic_or_expression_measurement	no	2026-07-12
26895921	10.1007/s00464-016-4808-y	2016	Oncologic outcomes of robotic thyroidectomy: 5-year experience with propensity score matching.	title_abstract	exclude	no_transcriptomic_or_expression_measurement	no	2026-07-12
27799794	10.2147/OTT.S84625	2016	Lenvatinib and other tyrosine kinase inhibitors for the treatment of radioiodine refractory, advanced, and progressive thyroid cancer.	title_abstract	exclude	no_eligible_human_endpoint_linked_program_or_marker	no	2026-07-12
27751975	10.4274/mirt.13007	2016	Adverse Reactions to Radioiodine 131I Therapy of Goiter in West African Tertiary Hospital.	title_abstract	exclude	no_transcriptomic_or_expression_measurement	no	2026-07-12
27443325	10.1136/bmj.i3839	2016	Use of imaging tests after primary treatment of thyroid cancer in the United States: population based retrospective cohort study evaluating death and recurrence.	title_abstract	exclude	no_transcriptomic_or_expression_measurement	no	2026-07-12
27138882	10.1007/s00268-016-3534-x	2016	BRAF(V600E) Mutation is Associated with Decreased Disease-Free Survival in Papillary Thyroid Cancer.	title_abstract	exclude	no_eligible_human_endpoint_linked_program_or_marker	no	2026-07-12
26370117	10.1007/s12020-015-0739-y	2016	Molecular profiles of cancer stem-like cell populations in aggressive thyroid cancers.	title_abstract	exclude	no_eligible_human_endpoint_linked_program_or_marker	no	2026-07-12
27342319	10.1186/s13046-016-0377-0	2016	miRNA-106a directly targeting RARB associates with the expression of Na(+)/I(-) symporter in thyroid cancer by regulating MAPK signaling pathway.	title_abstract	exclude	no_eligible_human_endpoint_linked_program_or_marker	no	2026-07-12
26879594	10.1111/bcp.12907	2016	Population pharmacokinetic analysis of lenvatinib in healthy subjects and patients with cancer.	title_abstract	exclude	no_transcriptomic_or_expression_measurement	no	2026-07-12
27015828	10.1007/s00411-016-0647-4	2016	Cytogenetic effects of radioiodine therapy: a 20-year follow-up study.	title_abstract	exclude	no_eligible_human_endpoint_linked_program_or_marker	no	2026-07-12
26930182	10.1210/jc.2015-3960	2016	Pediatric Thyroid Cancer: Postoperative Classifications and Response to Initial Therapy as Prognostic Factors.	title_abstract	exclude	no_transcriptomic_or_expression_measurement	no	2026-07-12
26847808	10.1001/jamaoncol.2015.5927	2016	Toxic Effects of Sorafenib in Patients With Differentiated Thyroid Carcinoma Compared With Other Cancers.	title_abstract	exclude	no_eligible_human_endpoint_linked_program_or_marker	no	2026-07-12
25537365	10.1002/hed.23974	2016	Effect of recombinant human thyroid-stimulating hormone or levothyroxine withdrawal on salivary gland dysfunction after radioactive iodine administration for thyroid remnant ablation.	title_abstract	exclude	no_transcriptomic_or_expression_measurement	no	2026-07-12
27011326	10.1371/journal.pone.0151968	2016	Family of microRNA-146 Regulates RARβ in Papillary Thyroid Carcinoma.	title_abstract	exclude	no_eligible_human_endpoint_linked_program_or_marker	no	2026-07-12
26751190	10.1210/jc.2015-3433	2016	Robust Thyroid Gene Expression and Radioiodine Uptake Induced by Simultaneous Suppression of BRAF V600E and Histone Deacetylase in Thyroid Cancer Cells.	title_abstract	exclude	no_eligible_human_endpoint_linked_program_or_marker	no	2026-07-12
27013865	10.2147/DDDT.S93459	2016	Spotlight on lenvatinib in the treatment of thyroid cancer: patient selection and perspectives.	title_abstract	exclude	no_eligible_human_endpoint_linked_program_or_marker	no	2026-07-12
26867945	10.1007/s11523-015-0416-3	2016	Lenvatinib: A Review in Refractory Thyroid Cancer.	title_abstract	exclude	review_or_secondary_source	no	2026-07-12
26659220	10.1634/theoncologist.2015-0179	2016	Effect of Thyrotropin Suppression Therapy on Bone in Thyroid Cancer Patients.	title_abstract	exclude	no_eligible_human_endpoint_linked_program_or_marker	no	2026-07-12
26285789	10.1007/s11523-015-0380-y	2016	Does Molecular Genotype Provide Useful Information in the Management of Radioiodine Refractory Thyroid Cancers? Results of a Retrospective Study.	title_abstract	exclude	no_eligible_human_endpoint_linked_program_or_marker	no	2026-07-12
31258797	10.4183/aeb.2016.30	2016	EVALUATION OF CARDIOVASCULAR RISK AND MYOCARDIAL PERFUSION IN PATIENTS WITH RADICALLY TREATED DIFFERENTIATED THYROID CARCINOMA AND REPEATED EPISODES OF IATROGENIC HYPOTHYROIDISM.	title_abstract	exclude	no_transcriptomic_or_expression_measurement	no	2026-07-12
27997908	10.1159/000453190	2016	Circulating Long Non-Coding RNAs Act as Biomarkers for Predicting 131I Uptake and Mortality in Papillary Thyroid Cancer Patients with Lung Metastases.	title_abstract	advance_to_full_text	potentially_eligible	yes	2026-07-12
26711165	10.1684/abc.2015.1106	2016	[Advances in thyroglobulin assays and their impact on the management of differentiated thyroid cancers].	title_abstract	exclude	no_relevant_radioiodine_construct	no	2026-07-12
26036600	10.1007/s40618-015-0319-2	2016	Predictors of incomplete response to therapy among Filipino patients with papillary thyroid cancer in a tertiary hospital.	title_abstract	exclude	no_transcriptomic_or_expression_measurement	no	2026-07-12
26487760	10.1158/1078-0432.CCR-15-0923	2015	Lenvatinib in Advanced, Radioactive Iodine-Refractory, Differentiated Thyroid Carcinoma.	title_abstract	exclude	no_transcriptomic_or_expression_measurement	no	2026-07-12
26798849	10.1358/dot.2015.51.12.2420390	2015	Pharmacological and clinical profile of lenvatinib (E-7080) in the treatment of advanced, radioiodine-refractory, differentiated thyroid cancer.	title_abstract	exclude	no_eligible_human_endpoint_linked_program_or_marker	no	2026-07-12
26426092	10.1111/cas.12826	2015	Subgroup analysis of Japanese patients in a phase 3 study of lenvatinib in radioiodine-refractory differentiated thyroid cancer.	title_abstract	exclude	no_transcriptomic_or_expression_measurement	no	2026-07-12
26337803	10.1186/s13550-015-0123-1	2015	Radioiodinated PARP1 tracers for glioblastoma imaging.	title_abstract	exclude	no_relevant_radioiodine_construct	no	2026-07-12
26231351	10.1007/s00259-015-3124-4	2015	"Difficulties in deciding whether to ablate patients with putatively ""low-intermediate-risk"" differentiated thyroid carcinoma: do guidelines mainly apply in the centres that produce them? Results of a retrospective, two-centre quality assurance study."	title_abstract	exclude	review_or_secondary_source	no	2026-07-12
26173620	10.1007/s00259-015-3114-6	2015	Multiparametric PET imaging in thyroid malignancy characterizing tumour heterogeneity: somatostatin receptors and glucose metabolism.	title_abstract	exclude	no_eligible_human_endpoint_linked_program_or_marker	no	2026-07-12
26305420	10.3109/00365513.2015.1057895	2015	IL-4, IL-10 and high sensitivity-CRP as potential serum biomarkers of persistent/recurrent disease in papillary thyroid carcinoma with/without Hashimoto's thyroiditis.	title_abstract	exclude	no_transcriptomic_or_expression_measurement	no	2026-07-12
25784309	10.1002/hed.24054	2015	Quantitative reverse transcription polymerase chain reaction-based detection of thyroid-specific gene expression in fine-needle aspirate for thyroid cancer recurrence evaluation: a case report and review of the literature.	title_abstract	exclude	review_or_secondary_source	no	2026-07-12
26148673	10.1089/thy.2015.0079	2015	Negative Expression of CPSF2 Predicts a Poorer Clinical Outcome in Patients with Papillary Thyroid Carcinoma.	title_abstract	exclude	no_relevant_radioiodine_construct	no	2026-07-12
26003547	10.1007/s12022-015-9376-5	2015	Encapsulated Thyroid Carcinoma of Follicular Cell Origin.	title_abstract	exclude	no_relevant_radioiodine_construct	no	2026-07-12
