pmid	doi	year	title	screening_stage	decision	primary_reason	full_text_assessed	freeze_date
42252965	10.1080/07853890.2026.2657641	2026	Postoperative stimulated thyroglobulin and the ps-tg/TSH ratio enhance the 2025 ATA risk stratification for predicting radioiodine response in papillary thyroid carcinoma.	title_abstract	exclude	no_transcriptomic_or_expression_measurement	no	2026-07-12
41786355	10.1002/hed.70221	2026	Lenvatinib as Neoadjuvant Therapy in Locally Advanced Thyroid Cancer: CT-Based Selection and Outcomes From a 23-Patient Cohort.	title_abstract	exclude	no_eligible_human_endpoint_linked_program_or_marker	no	2026-07-12
42430188	10.1128/spectrum.03237-25	2026	Dynamic effects of radioactive iodine therapy on gut microbiota and metabolites in patients with papillary thyroid cancer.	title_abstract	exclude	no_transcriptomic_or_expression_measurement	no	2026-07-12
42420643	10.1007/s11307-026-02114-8	2026	LLM-Enhanced Multimodal Fusion of SPECT Radiomics and Clinical Data for Predicting 131I Therapeutic Response in Differentiated Thyroid Cancer.	title_abstract	exclude	no_transcriptomic_or_expression_measurement	no	2026-07-12
42433550	10.21037/qims-2025-1-2776	2026	Comparison between 99mTcO4 - SPECT/CT and diagnostic 131I SPECT/CT for the detection of postoperative thyroid remnant in patients with differentiated thyroid cancer.	title_abstract	exclude	no_transcriptomic_or_expression_measurement	no	2026-07-12
41954613	10.1158/1078-0432.CCR-25-3945	2026	AL2846, a Novel Multi-Kinase Inhibitor, for Previously Treated Radioiodine-Refractory Differentiated Thyroid Cancer: Exploratory Clinical Results From the Phase Ib Study.	title_abstract	exclude	no_transcriptomic_or_expression_measurement	no	2026-07-12
42363265	10.1186/s13044-026-00306-6	2026	Single-cell RNA sequencing in thyroid cancer: a methodological review and thyroid specific dissociation protocol.	title_abstract	exclude	review_or_secondary_source	no	2026-07-12
42325083	10.1002/1878-0261.70181	2026	The role of miR-335-5p in the redifferentiation of BRAF p.V600E thyroid cancers.	title_abstract	exclude	non_human_or_preclinical_only	no	2026-07-12
42323057	10.1016/j.critrevonc.2026.105439	2026	Targeting ncRNA control networks with engineered exosomes to overcome therapy resistance in thyroid cancer.	title_abstract	exclude	no_eligible_human_endpoint_linked_program_or_marker	no	2026-07-12
42322900	10.1016/j.currproblcancer.2026.101315	2026	Clinical impact of a single time-point protocol paired FDG-PET and radioactive iodine scan for comprehensive disease assessment in differentiated thyroid cancer.	title_abstract	exclude	no_eligible_human_endpoint_linked_program_or_marker	no	2026-07-12
42274916	10.1007/s11604-026-01982-y	2026	Predictive factors for therapeutic response to radioactive iodine therapy in pulmonary metastases from differentiated thyroid carcinoma.	title_abstract	exclude	no_transcriptomic_or_expression_measurement	no	2026-07-12
42295060	10.1097/MNM.0000000000002192	2026	Serum cytokine profiles in papillary thyroid carcinoma patients with lung metastases: characteristics and the relationship with prognosis.	title_abstract	exclude	no_transcriptomic_or_expression_measurement	no	2026-07-12
42251484	10.1080/17843286.2026.2680287	2026	TKI-associated proteinuria and nephrotic syndrome: a narrative review with clinical illustration in radio-iodine-refractory thyroid cancer.	title_abstract	exclude	review_or_secondary_source	no	2026-07-12
42385380	10.1016/j.surg.2026.110382	2026	Absence of survival benefit from radioactive iodine therapy in T3b differentiated thyroid cancer: A Surveillance, Epidemiology, and End Results-Based cohort study.	title_abstract	exclude	no_transcriptomic_or_expression_measurement	no	2026-07-12
42236533	10.1038/s41598-026-54570-5	2026	MAPK pathway inhibitors enhance radioiodine sensitivity in anaplastic thyroid carcinoma through promoting NIS expression and ARF4-mediated NIS membrane transport.	title_abstract	exclude	no_eligible_human_endpoint_linked_program_or_marker	no	2026-07-12
42351702	10.3390/biomedicines14061274	2026	Where Does Liquid Biopsy Add Value in Thyroid Cancer? Biological Rationale, Technological Innovation, and Clinical Utility.	title_abstract	exclude	no_eligible_human_endpoint_linked_program_or_marker	no	2026-07-12
42395165	10.1055/s-0046-1822663	2026	Observation on Discordant Treatment Response on [ 18 F]FDG and [ 68 Ga]Ga-FAPI-04 PET/CT in Radioiodine-Refractory Thyroid Carcinoma Treated with Lenvatinib.	title_abstract	exclude	no_eligible_human_endpoint_linked_program_or_marker	no	2026-07-12
42139545	10.1093/ejendo/lvag091	2026	Who leads, who treats, what dose? European paediatric differentiated thyroid carcinoma practice-an European Cooperative Study Group for Paediatric Rare Tumours survey.	title_abstract	exclude	no_eligible_human_endpoint_linked_program_or_marker	no	2026-07-12
42132097	10.1177/10507256261448724	2026	TSH Stimulation Methods are Associated with Comparable Outcomes in Radioiodine-Avid Metastatic Differentiated Thyroid Cancer: Single Center Retrospective Observational Study.	title_abstract	exclude	no_eligible_human_endpoint_linked_program_or_marker	no	2026-07-12
42126497	10.1007/s11596-026-00206-8	2026	Glucose Metabolic Reprogramming in Thyroid Cancer: Underlying Molecular Mechanisms and Links to Progression and Treatment.	title_abstract	exclude	no_transcriptomic_or_expression_measurement	no	2026-07-12
42048109	10.1530/ETJ-25-0237	2026	Assessing the sodium-iodide symporter (NIS) in pediatric differentiated thyroid carcinoma.	title_abstract	exclude	no_relevant_radioiodine_construct	no	2026-07-12
41973661	10.1177/10507256261442836	2026	Real-World Efficacy and Safety of Lenvatinib and Sorafenib in Thyroid Cancer: A Retrospective, Propensity-Score-Matched Study.	title_abstract	exclude	no_transcriptomic_or_expression_measurement	no	2026-07-12
42290855	10.3389/fendo.2026.1856987	2026	The diagnosis and management of ectopic thyroid cancer: a systematic review.	title_abstract	exclude	review_or_secondary_source	no	2026-07-12
42351648	10.3390/biomedicines14061222	2026	FOXP Transcription Factors in Thyroid Cancer: From Molecular Expression to Clinical Significance.	title_abstract	exclude	no_eligible_human_endpoint_linked_program_or_marker	no	2026-07-12
42232186	10.3389/fphar.2026.1789743	2026	A RAIR-ATC transcriptional axis and multimodal drug-response modelling reveal class-level vulnerabilities in thyroid cancer.	title_abstract	advance_to_full_text	potentially_eligible	yes	2026-07-12
42179850	10.2147/IJGM.S602509	2026	Precision Thyroid Oncology: A Review of Multi-Omics Biomarkers and Spatiotemporal Technologies.	title_abstract	exclude	review_or_secondary_source	no	2026-07-12
42023590	10.1530/EC-26-0144	2026	The IGF signaling axis in thyroid cancer: biological complexity and therapeutic challenges.	title_abstract	exclude	no_transcriptomic_or_expression_measurement	no	2026-07-12
42181184	10.3389/fendo.2026.1747769	2026	Efficacy and safety of 125I seed implantation combined with thyroid-stimulating hormone suppression therapy in cervical lymph node metastases of differentiated thyroid carcinoma.	title_abstract	exclude	no_transcriptomic_or_expression_measurement	no	2026-07-12
42312279	10.4103/jiaps.jiaps_425_25	2026	Is There a Role for External Radiation Therapy in Pediatric Differentiated Thyroid Cancer?	title_abstract	exclude	no_transcriptomic_or_expression_measurement	no	2026-07-12
41891970	10.3892/or.2026.9105	2026	[Retracted] Roles of the SNHG7/microRNA‑9‑5p/DPP4 ceRNA network in the growth and 131I resistance of thyroid carcinoma cells through PI3K/Akt activation.	title_abstract	exclude	no_eligible_human_endpoint_linked_program_or_marker	no	2026-07-12
42137348	10.3389/fendo.2026.1810839	2026	Postoperative serum oxidative stress measures in women with papillary thyroid cancer.	title_abstract	exclude	no_eligible_human_endpoint_linked_program_or_marker	no	2026-07-12
42057062	10.1186/s12957-026-04371-x	2026	Surgical management of spinal metastases originating from thyroid cancer.	title_abstract	exclude	no_transcriptomic_or_expression_measurement	no	2026-07-12
42046098	10.1186/s12967-026-08190-2	2026	Inhibition of ATM reverses radioiodine resistance in differentiated thyroid cancer via genotoxic stress amplification.	title_abstract	exclude	no_eligible_human_endpoint_linked_program_or_marker	no	2026-07-12
42043444	10.1007/s00335-026-10225-4	2026	Oncogenic role of LncRNA DLEU2 in thyroid cancer through a NAT10/USP39 regulatory axis.	title_abstract	exclude	no_eligible_human_endpoint_linked_program_or_marker	no	2026-07-12
41921036	10.1530/EC-25-0712	2026	Characterization of the patient profile and efficacy of empirical radioiodine therapy in differentiated thyroid cancer with biochemical evidence without identified iodine-avid structural metastatic disease.	title_abstract	exclude	no_transcriptomic_or_expression_measurement	no	2026-07-12
41989876	10.1530/ERC-25-0424	2026	Value of TERT Promoter Mutations for Early Outcomes in Papillary Thyroid Cancer.	title_abstract	exclude	no_eligible_human_endpoint_linked_program_or_marker	no	2026-07-12
41979698	10.1186/s13550-026-01414-y	2026	Assessing vascular inflammation during continuous TSH suppression in differentiated thyroid cancer: a longitudinal [18F]FDG PET/CT analysis.	title_abstract	exclude	no_transcriptomic_or_expression_measurement	no	2026-07-12
41975028	10.1038/s41598-026-48310-y	2026	Positive prognostic implications of SPHK1 expression in patients with papillary thyroid carcinoma undergoing radioactive iodine therapy.	title_abstract	exclude	no_eligible_human_endpoint_linked_program_or_marker	no	2026-07-12
41942615	10.1038/s41598-026-47698-x	2026	Impact of delayed first radioiodine therapy on response evaluation in intermediate risk differentiated thyroid cancer.	title_abstract	exclude	no_eligible_human_endpoint_linked_program_or_marker	no	2026-07-12
41992056	10.1002/cam4.71742	2026	Immunotherapy in Thyroid Cancer: Current Strategies and Challenges.	title_abstract	exclude	no_eligible_human_endpoint_linked_program_or_marker	no	2026-07-12
41969334	10.1016/j.eclinm.2026.103839	2026	A histo-clinical score to predict evolution to radioactive iodine-refractory of the follicular cell-derived thyroid carcinoma (PREDIRAIR): a single-centre, prospective, cohort study.	title_abstract	exclude	no_transcriptomic_or_expression_measurement	no	2026-07-12
41889257	10.1002/acm2.70555	2026	Interpretable LightGBM model with SHAP analysis predicts non-excellent response to initial radioiodine therapy in differentiated thyroid carcinoma.	title_abstract	exclude	no_eligible_human_endpoint_linked_program_or_marker	no	2026-07-12
41649339	10.20945/2359-4292-2026-0008	2026	Immunotherapy response in microsatellite-stable poorly differentiated thyroid carcinoma with mismatch repair deficiency and high tumor mutational burden.	title_abstract	exclude	no_eligible_human_endpoint_linked_program_or_marker	no	2026-07-12
41539228	10.1016/j.cancergen.2026.01.005	2026	M6A methylation in thyroid cancer: Functions, mechanisms, and clinical significance.	title_abstract	exclude	no_eligible_human_endpoint_linked_program_or_marker	no	2026-07-12
41417201	10.1007/s12149-025-02137-1	2026	Clinical value of clinicopathological, ultrasonographic features and fibroblast activation protein in evaluating the radioiodine treatment efficacy in papillary thyroid carcinoma.	title_abstract	exclude	no_eligible_human_endpoint_linked_program_or_marker	no	2026-07-12
42042023	10.3390/cimb48040362	2026	Molecular Mechanisms of Radioiodine Refractoriness in Differentiated Thyroid Cancer: Focus on Sodium/Iodide Symporter Dysregulation.	title_abstract	exclude	no_eligible_human_endpoint_linked_program_or_marker	no	2026-07-12
41969519	10.21037/tcr-2025-aw-2437	2026	Gene expression profile, and role of baicalein in the inhibition of thyroid cancer.	title_abstract	exclude	no_eligible_human_endpoint_linked_program_or_marker	no	2026-07-12
41910579	10.23736/S1824-4785.26.03686-1	2026	FDG PET/CT imaging in recurrent papillary thyroid cancer: does BRAF mutation status matter?	title_abstract	exclude	no_transcriptomic_or_expression_measurement	no	2026-07-12
41891781	10.1210/clinem/dgag074	2026	Molecular Profile of Advanced Radioiodine-refractory Thyroid Cancer and Response to Lenvatinib Treatment.	title_abstract	exclude	no_eligible_human_endpoint_linked_program_or_marker	no	2026-07-12
41976284	10.3390/cancers18071058	2026	Unmeasurable Stimulated Thyroglobulin Before Radioactive Iodine Ablation Predicts Excellent Long-Term Outcomes in Patients with Differentiated Thyroid Cancer.	title_abstract	exclude	no_transcriptomic_or_expression_measurement	no	2026-07-12
41851192	10.1038/s41698-026-01371-8	2026	Impact of BRAF, TERT, and novel mutations on the efficacy of lenvatinib for advanced papillary thyroid cancer: A national genomic database analysis.	title_abstract	exclude	no_eligible_human_endpoint_linked_program_or_marker	no	2026-07-12
41877795	10.3389/fmed.2026.1790226	2026	Development and validation of a machine learning model for predicting high-risk distant metastatic recurrence in differentiated thyroid cancer.	title_abstract	exclude	no_transcriptomic_or_expression_measurement	no	2026-07-12
41801518	10.1007/s12020-025-04510-6	2026	MicroRNA signatures associated with radioiodine refractoriness and tumor dedifferentiation in metastatic papillary thyroid carcinoma.	title_abstract	advance_to_full_text	potentially_eligible	yes	2026-07-12
41858341	10.3389/fonc.2026.1748566	2026	Cabozantinib versus placebo in patients with radioiodine-refractory differentiated thyroid cancer after prior vascular endothelial growth factor receptor-targeted therapy (COSMIC-311): outcomes by BRAF status.	title_abstract	exclude	no_transcriptomic_or_expression_measurement	no	2026-07-12
41679192	10.1016/j.ebiom.2026.106165	2026	Disulfiram metabolite Cu(DDC)2 enhances radionuclide uptake in vivo revealing insights into tumoural ablation resistance.	title_abstract	exclude	no_eligible_human_endpoint_linked_program_or_marker	no	2026-07-12
41761234	10.1186/s13046-026-03675-w	2026	Mechanism of cancer-associated fibroblast-driven thyroid cancer dedifferentiation via the ZFP57-PKM2 axis-mediated lactate secretion and therapeutic intervention with resveratrol​.	title_abstract	exclude	no_eligible_human_endpoint_linked_program_or_marker	no	2026-07-12
41869262	10.7759/cureus.103878	2026	Two Cases of Papillary Thyroid Carcinoma With QTc Prolongation During Selpercatinib Administration: A Case Report.	title_abstract	exclude	no_eligible_human_endpoint_linked_program_or_marker	no	2026-07-12
41697514	10.1007/s12020-026-04563-1	2026	De-escalation strategies in the management of differentiated thyroid cancer.	title_abstract	exclude	no_transcriptomic_or_expression_measurement	no	2026-07-12
41686570	10.1097/MD.0000000000047658	2026	Construction and evaluation of a SPECT-based radiomics nomogram for predicting the therapeutic response to radioactive iodine in patients with differentiated thyroid carcinoma.	title_abstract	exclude	no_eligible_human_endpoint_linked_program_or_marker	no	2026-07-12
41767494	10.3389/fmed.2026.1754058	2026	Advances in immunotherapy for thyroid malignancies: from molecular targets to clinical outcomes.	title_abstract	exclude	no_eligible_human_endpoint_linked_program_or_marker	no	2026-07-12
41627546	10.1007/s12020-025-04520-4	2026	The peripheral blood lymphocyte signatures forecast therapeutic efficacy in papillary thyroid cancer patients undergoing radioactive iodine therapy.	title_abstract	exclude	no_transcriptomic_or_expression_measurement	no	2026-07-12
41681776	10.3390/diagnostics16030456	2026	Dynamic Thyroglobulin Ratio as a Biomarker to Identify Papillary Thyroid Cancer Patients Who Would Benefit from a Low-Iodine Diet.	title_abstract	exclude	no_transcriptomic_or_expression_measurement	no	2026-07-12
41660935	10.31557/APJCP.2026.27.2.757	2026	Prognostic Stratification of Highly Differentiated Thyroid Cancer Based on Molecular Genetic Studies.	title_abstract	exclude	no_eligible_human_endpoint_linked_program_or_marker	no	2026-07-12
41296188	10.1007/s11154-025-10008-3	2026	Retroelements in thyroid cancer: epigenetic plasticity, dedifferentiation, and therapeutic opportunities.	title_abstract	exclude	no_eligible_human_endpoint_linked_program_or_marker	no	2026-07-12
41695167	10.3389/fmed.2026.1737911	2026	Case Report: Management of a challenging case presenting with dysphagia after thyroidectomy requiring administration of liquid 131I via MIC-KEY low-profile tube-a multidisciplinary approach.	title_abstract	exclude	no_transcriptomic_or_expression_measurement	no	2026-07-12
41685247	10.3389/fendo.2026.1737469	2026	Leveraging the transcriptome-phenotype relationship to guide clinical management of papillary thyroid cancer.	title_abstract	exclude	no_eligible_human_endpoint_linked_program_or_marker	no	2026-07-12
41532572	10.1530/JME-25-0135	2026	Linoleic acid reduces sodium-iodide symporter by inhibiting endoplasmic reticulum stress in papillary thyroid carcinoma.	title_abstract	exclude	no_eligible_human_endpoint_linked_program_or_marker	no	2026-07-12
41483448	10.1007/s12672-025-04317-x	2026	Exploring molecular mechanisms of radioactive iodine therapy in thyroid cancer using single-cell RNA sequencing data.	title_abstract	exclude	no_eligible_human_endpoint_linked_program_or_marker	no	2026-07-12
41467912	10.1177/10507256251409134	2026	Thyroglobulin Cutoffs after Total Thyroidectomy Without Radioiodine in Low- to Intermediate-Risk Thyroid Cancer: A Multicenter Cohort Study.	title_abstract	exclude	no_transcriptomic_or_expression_measurement	no	2026-07-12
41391992	10.1053/j.semnuclmed.2025.11.014	2026	Response assessment in advanced differentiated thyroid cancer.	title_abstract	exclude	no_eligible_human_endpoint_linked_program_or_marker	no	2026-07-12
41058325	10.1016/j.surg.2025.109698	2026	Validation of molecular profiling to preoperatively predict aggressive pathologic features in differentiated thyroid cancer.	title_abstract	exclude	no_eligible_human_endpoint_linked_program_or_marker	no	2026-07-12
40857765	10.1016/j.talanta.2025.128721	2026	Non-radiative quantitation of NIS-dependent iodine accumulation in cells using single-cell inductively coupled plasma mass spectrometry.	title_abstract	exclude	non_human_or_preclinical_only	no	2026-07-12
33760495		2026	Oncocytic (Hürthle Cell) Thyroid Carcinoma	title_abstract	exclude	no_eligible_human_endpoint_linked_program_or_marker	no	2026-07-12
41595456	10.3390/genes17010036	2025	Review of Genomic Drivers of Thyroid Cancer and Their Clinical Implications.	title_abstract	exclude	review_or_secondary_source	no	2026-07-12
41368991	10.1530/ETJ-25-0225	2025	BRAF V600E in thyroid cancer: navigating prognostic uncertainty and therapeutic opportunity.	title_abstract	exclude	no_eligible_human_endpoint_linked_program_or_marker	no	2026-07-12
41353405	10.1038/s41598-025-31110-1	2025	Comparative survival outcomes of lobectomy versus total thyroidectomy in T1 and T2 papillary thyroid cancer with more than five positive lymph nodes.	title_abstract	exclude	no_transcriptomic_or_expression_measurement	no	2026-07-12
41462994	10.3390/biomedicines13122982	2025	Dedifferentiation and Redifferentiation of Follicular-Cell-Derived Thyroid Carcinoma: Mechanisms and Therapeutic Implications.	title_abstract	exclude	no_eligible_human_endpoint_linked_program_or_marker	no	2026-07-12
41257455	10.1530/ERC-25-0167	2025	Clinical relevance of the thyroid differentiation score (TDS) in benign and malignant thyroid tumors.	title_abstract	exclude	no_relevant_radioiodine_construct	no	2026-07-12
41215686	10.1080/20565623.2025.2580889	2025	Mechanisms and pathways of ROS and autophagy in thyroid cancer.	title_abstract	exclude	no_eligible_human_endpoint_linked_program_or_marker	no	2026-07-12
41023438	10.1007/s11307-025-02053-w	2025	Peptide Receptor Radionuclide Therapy with Lu-177-DOTATATE and Monitoring with Somatostatin Receptor PET/CT in Patients with Advanced Differentiated Thyroid Carcinoma.	title_abstract	exclude	no_transcriptomic_or_expression_measurement	no	2026-07-12
40999970	10.3892/or.2025.8993	2025	Relationship between amino acid transporter activity and radioactive iodine therapy efficacy in differentiated thyroid cancer.	title_abstract	exclude	no_eligible_human_endpoint_linked_program_or_marker	no	2026-07-12
40985353	10.1002/advs.202513243	2025	TSH Ligand-Based CAR-T Cell Effectively Eradicates TSHR-Positive Thyroid Cancer with Favorable Safety Profile.	title_abstract	exclude	no_eligible_human_endpoint_linked_program_or_marker	no	2026-07-12
41312853	10.20945/2359-4292-2025-0129	2025	The clinical utility of thermal ablation procedures in thyroid nodules: Latin American Thyroid Society (LATS) surgical affairs committee expert opinion. Part 2.	title_abstract	exclude	no_eligible_human_endpoint_linked_program_or_marker	no	2026-07-12
41254058	10.1038/s41598-025-24397-7	2025	Gut microbiota and metabolite profiles in thyroid cancer lymph node metastasis: a multi-omics analysis.	title_abstract	exclude	no_relevant_radioiodine_construct	no	2026-07-12
40165363	10.1210/clinem/dgaf190	2025	Prospective Validation of ATA Risk Score for Papillary Thyroid Microcarcinoma: An ITCO Real-World Study.	title_abstract	exclude	no_transcriptomic_or_expression_measurement	no	2026-07-12
40976118	10.1016/j.prp.2025.156231	2025	The role of WNT signaling in papillary thyroid cancer: Mechanisms, epigenetic regulation, therapeutic resistance, and emerging clinical strategies.	title_abstract	exclude	no_eligible_human_endpoint_linked_program_or_marker	no	2026-07-12
40880035	10.1007/s40265-025-02233-6	2025	Systemic Therapy for Advanced Thyroid Cancer-New Personalized Options.	title_abstract	exclude	no_eligible_human_endpoint_linked_program_or_marker	no	2026-07-12
40414995	10.1007/s00259-025-07339-3	2025	Less is more: once vs. multiple radioactive iodine (RAI) therapy in patients with RAI-avid pulmonary micrometastatic differentiated thyroid cancer.	title_abstract	exclude	no_transcriptomic_or_expression_measurement	no	2026-07-12
41283251	10.3390/medsci13040250	2025	Elevated NIS Expression Correlates with Chemoresistance in Triple-Negative Breast Cancer: Potential Link to FOXA1 Activity.	title_abstract	exclude	no_eligible_human_endpoint_linked_program_or_marker	no	2026-07-12
41234719	10.3389/fonc.2025.1570684	2025	Progress of long-chain noncoding small nucleolar RNA host genes in thyroid cancer.	title_abstract	exclude	no_eligible_human_endpoint_linked_program_or_marker	no	2026-07-12
41079885	10.1530/EO-25-0026	2025	Macrophage abundance in oncocytic thyroid cancer is associated with PD-L1 expression.	title_abstract	exclude	no_eligible_human_endpoint_linked_program_or_marker	no	2026-07-12
41039489	10.1186/s13044-025-00266-3	2025	CD44v6 expression in non-anaplastic thyroid carcinoma: characterization of candidates for targeted therapy.	title_abstract	exclude	no_eligible_human_endpoint_linked_program_or_marker	no	2026-07-12
40616765	10.1007/s12020-025-04316-6	2025	Prognostic impact and clinical staging adjustment of tumor deposits in postoperative radioiodine therapy for differentiated thyroid cancer.	title_abstract	exclude	no_transcriptomic_or_expression_measurement	no	2026-07-12
40576429	10.1097/JS9.0000000000002838	2025	Multicenter analysis of radioactive iodine therapy outcomes after total thyroidectomy for T1-T2 stage papillary thyroid carcinoma with cervical lymph node metastasis in China.	title_abstract	exclude	no_transcriptomic_or_expression_measurement	no	2026-07-12
41097727	10.3390/cancers17193201	2025	Gadd45B Deficiency Drives Radio-Resistance in BRAFV600E-Mutated Differentiated Thyroid Cancer by Disrupting Iodine Metabolic Genes.	title_abstract	exclude	no_eligible_human_endpoint_linked_program_or_marker	no	2026-07-12
40988283	10.1097/MD.0000000000044540	2025	Prognostic significance of BRAF V600E and TERT promoter mutations in radioiodine resistance and recurrence of differentiated thyroid cancer.	title_abstract	exclude	no_eligible_human_endpoint_linked_program_or_marker	no	2026-07-12
40959084	10.3389/fimmu.2025.1651088	2025	Personalised immunotherapy strategies informed by single cell profiling in thyroid cancer: a mini review.	title_abstract	exclude	review_or_secondary_source	no	2026-07-12
40714960	10.1002/wjs.12683	2025	Tall Cell Variant Histology Predicts Poorer Disease-Free Survival in Papillary Thyroid Carcinoma: A Propensity-Matched Cohort Study.	title_abstract	exclude	no_transcriptomic_or_expression_measurement	no	2026-07-12
40701069	10.1016/j.oraloncology.2025.107513	2025	Turning tumor microenvironmental foes to friends: A new opportunity for thyroid cancer therapy and redifferentiation.	title_abstract	exclude	no_eligible_human_endpoint_linked_program_or_marker	no	2026-07-12
40583572	10.1097/MNM.0000000000002006	2025	Prednisone-aided gross thyroid remnant ablation using 5.55 GBq of radioiodine in patients with differentiated thyroid cancer.	title_abstract	exclude	no_transcriptomic_or_expression_measurement	no	2026-07-12
40560352	10.1007/s42000-025-00692-w	2025	Distinctive hobnail subtype of papillary thyroid carcinoma: a case series and short review of literature.	title_abstract	exclude	review_or_secondary_source	no	2026-07-12
40482736	10.1016/j.critrevonc.2025.104792	2025	Exploring the role of TERT in thyroid Cancer: A systematic review.	title_abstract	exclude	review_or_secondary_source	no	2026-07-12
40357638	10.1097/RLU.0000000000005940	2025	Impact of Therapeutic Radioactive Iodine on the Recurrence of Papillary Thyroid Cancer With Extranodal Extension in Metastatic Lymph Nodes: A Propensity Score-matched Analysis.	title_abstract	exclude	no_transcriptomic_or_expression_measurement	no	2026-07-12
